headline,section,locations,word_count,snippet,source,subjects,url,date,type,idMexico Will Seek Debt Relief,Business,[u'MEXICO'],1037,"LEAD: Seeking ways to lighten its debt burden, Mexico will ask its American creditors and other foreign bankers to cut the value of their loans by $20 billion to $30 billion, international banking officials said today....",The New York Times,[u'CREDIT'],http://www.nytimes.com/1989/04/13/business/mexico-will-seek-debt-relief.html,4/13/89,News,4fd195018eb7c8105d6a0b7c"Stocks Are Higher, With Dow Rising 8.07",Business,[],384,"LEAD: Stocks moved higher yesterday, and the Dow Jones industrial average rose 8.07 points, to 2,319.65....",The New York Times,"[u'STOCKS AND BONDS', u'DOW JONES STOCK AVERAGE', u'STOCK PRICES AND TRADING VOLUME']",http://www.nytimes.com/1989/04/13/business/stocks-are-higher-with-dow-rising-8.07.html,4/13/89,News,4fd1884e8eb7c8105d6887a7Economic Scene; Pressures for Shift In Trade Policy,Business,[u'UNITED STATES'],869,LEAD: PRESSURES are building in Congress and among business groups for the Bush Administration to impose on its trading partners quantitative targets for American exports. Those pressures are stemming from discouragement over the persistence of th...,The New York Times,"[u'INTERNATIONAL TRADE AND WORLD MARKET', u'BALANCE OF PAYMENTS AND TRADE']",http://www.nytimes.com/1989/04/14/business/economic-scene-pressures-for-shift-in-trade-policy.html,4/14/89,News,4fd1a2e88eb7c8105d6b9e9bWhere British Remain A Power: Advertising,Business,[u'GREAT BRITAIN'],1089,"LEAD: Where Americans tend to get mad at advertising, the British are advertising-mad....",The New York Times,"[u'ADVERTISING', u'TELEVISION', u'AWARDS, DECORATIONS AND HONORS']",http://www.nytimes.com/1989/04/14/business/where-british-remain-a-power-advertising.html,4/14/89,News,4fd195068eb7c8105d6a0ecaBUSINESS DIGEST,Business,[],596,LEAD:  The Economy...,The New York Times,[],http://www.nytimes.com/1989/04/14/business/business-digest-031289.html,4/14/89,Summary,4fd193018eb7c8105d69cd27A Broad Fall For Stocks; Dow Off 23.65,Business,[u'UNITED STATES'],478,"LEAD: Stocks retreated across a broad front yesterday and the Dow Jones industrial average fell 23.65 points, to 2,296.00....",The New York Times,"[u'STOCKS AND BONDS', u'DOW JONES STOCK AVERAGE', u'STOCK PRICES AND TRADING VOLUME']",http://www.nytimes.com/1989/04/14/business/a-broad-fall-for-stocks-dow-off-23.65.html,4/14/89,News,4fd193018eb7c8105d69cd2aWhy Pick on Milken for Having Made Money?,Opinion,[],258,LEAD: To the Editor:...,The New York Times,[u'TERMS NOT AVAILABLE'],http://www.nytimes.com/1989/04/15/opinion/l-why-pick-on-milken-for-having-made-money-157489.html,4/15/89,Letter,4fd1884f8eb7c8105d6887d1U.S. Trade Deficit Widens Sharply,Business,[u'UNITED STATES'],958,"LEAD: The nation's trade deficit widened sharply in February, the Commerce Department said today, as demand for foreign cars, industrial supplies and consumer goods overwhelmed a slight rise in exports....",The New York Times,"[u'INTERNATIONAL TRADE AND WORLD MARKET', u'BALANCE OF PAYMENTS AND TRADE']",http://www.nytimes.com/1989/04/15/business/us-trade-deficit-widens-sharply.html,4/15/89,News,4fd1a2068eb7c8105d6b8089Prospects; The Trade Gap Widens,Health; Business,[u'UNITED STATES'],574,"LEAD: The balance-of-trade figures for February, released Friday, showed a widening of the deficit to $10.5 billion, up from January's $8.6 billion deficit. Imports increased 5.6 percent in February, while exports grew by a negligible amount. Thre...",The New York Times,"[u'INTERNATIONAL TRADE AND WORLD MARKET', u'BALANCE OF PAYMENTS AND TRADE']",http://www.nytimes.com/1989/04/16/business/prospects-the-trade-gap-widens.html,4/16/89,News,4fd1831c8eb7c8105d6804a6Experts Divided On Jobs in the 90's,,[u'UNITED STATES'],4233,"LEAD: THE nation's unemployment rate, 4.9 percent, is at its lowest point in the last 15 years. But at the same time the number of new jobs has fallen to its lowest monthly level since last August. What do these figures portend for the nation's wo...",The New York Times,"[u'UNEMPLOYMENT AND JOB MARKET', u'LABOR', u'FORECASTS']",http://www.nytimes.com/1989/04/16/jobs/experts-divided-on-jobs-in-the-90-s.html,4/16/89,Interview,4fd1a2888eb7c8105d6b8b0bEasing the Next Slump,Business,[],1591,"LEAD: With the economic expansion running out of steam, a number of economists are predicting a recession next year. But many of them lean toward the view that the setback will be short and shallow. One reason is that they believe corporate profit...",The New York Times,"[u'RECESSION AND DEPRESSION', u'MERGERS, ACQUISITIONS AND DIVESTITURES', u'CAPITAL INVESTMENT', u'UNITED STATES ECONOMY', u'FORECASTS', u'CREDIT', u'PROFITS (INDUSTRY-WIDE)']",http://www.nytimes.com/1989/04/16/business/easing-the-next-slump.html,4/16/89,News,4fd1a2dc8eb7c8105d6b95d8The Red-Eye Disease,Opinion,"[u'EUROPE, EAST', u'UNION OF SOVIET SOCIALIST REPUBLICS (USSR)']",799,"LEAD: In Moscow recently, a veteran American expert made a comparison. Americans want ''to keep up with the Joneses,'' even if it means a frenetic rat race. Russians worry about ''keeping the Joneskis at our level; why should they get ahead?'' Con...",The New York Times,[u'REFORM AND REORGANIZATION'],http://www.nytimes.com/1989/04/16/opinion/foreign-affairs-the-red-eye-disease.html,4/16/89,Op-Ed,4fd18aee8eb7c8105d68d008There's a Demand for Instruction in Democracy,Week in Review,"[u'SPAIN', u'HUNGARY']",978,"LEAD: CAN Hungary in the 1990's pull off what Spain did in the 1970's: peacefully transform a one-party dictatorship into a parliamentary democracy? During a visit to Madrid last November, the Hungarian Communist leader, Karoly Grosz, intensely qu...",The New York Times,[u'HUNGARY-INTERNATIONAL RELATIONS-SPAIN'],http://www.nytimes.com/1989/04/16/weekinreview/the-world-there-s-a-demand-for-instruction-in-democracy.html,4/16/89,News,4fd1a3f98eb7c8105d6bb868Bush Unveils Aid Plan for Poland Linked to Recent Liberalization,World; Front Page; Washington,[u'POLAND'],1129,"LEAD: Declaring that ''the winds of change are shaping a new European destiny,'' President Bush today announced an economic aid program for Poland that acknowledges Warsaw's recent agreement to allow free elections....",The New York Times,"[u'UNITED STATES INTERNATIONAL RELATIONS', u'INTERNATIONAL RELATIONS', u'INTERNATIONAL TRADE AND WORLD MARKET', u'POLAND-INTERNATIONAL RELATIONS-US', u'FINANCES', u'CUSTOMS (TARIFF)', u'CREDIT', u'ECONOMIC CONDITIONS AND TRENDS', u'ELECTIONS', u'FOREIGN AID']",http://www.nytimes.com/1989/04/18/world/bush-unveils-aid-plan-for-poland-linked-to-recent-liberalization.html,4/18/89,News,4fd1a3fa8eb7c8105d6bb909"Stocks Mixed, Awaiting Economic Data",Business,[],376,LEAD: Stock prices were mixed yesterday as many investors stayed on the sidelines awaiting more news on the economy....,The New York Times,"[u'STOCKS AND BONDS', u'DOW JONES STOCK AVERAGE', u'STOCK PRICES AND TRADING VOLUME']",http://www.nytimes.com/1989/04/18/business/stocks-mixed-awaiting-economic-data.html,4/18/89,News,4fd183bc8eb7c8105d68185dDow Soars by 41.61; Bonds Also Advance,Business,[],1035,LEAD: Buoyed by investors' growing conviction that a slowing economy will contain inflation - and that interest rates may have peaked - the stock market staged another strong rally yesterday....,The New York Times,"[u'STOCKS AND BONDS', u'DOW JONES STOCK AVERAGE', u'STOCK PRICES AND TRADING VOLUME']",http://www.nytimes.com/1989/04/19/business/dow-soars-by-41.61-bonds-also-advance.html,4/19/89,News,4fd180c08eb7c8105d67cab0BUSINESS DIGEST,Business,[],619,"LEAD:  THE ECONOMY  Consumer prices climbed 0.5 percent in March, maintaining a 6.1 percent annual inflation rate for the first quarter. The latest increases were greeted with relief by investors, and stock and bond prices rose sharply.  [ Page A1...",The New York Times,[],http://www.nytimes.com/1989/04/19/business/business-digest-242389.html,4/19/89,Summary,4fd1a2078eb7c8105d6b810cDeep in the Heart Of Atlanta: Texans,Home and Garden,"[u'TEXAS', u'ATLANTA (GA)']",1283,LEAD: It was not a scene that will make its way into ''Lonesome Dove II.''...,The New York Times,[],http://www.nytimes.com/1989/04/19/garden/deep-in-the-heart-of-atlanta-texans.html,4/19/89,News,4fd183228eb7c8105d680a83Market Place; Surge Confirmed By Dow Theory,Business,[],886,"LEAD: THE Dow Theory, possibly the oldest technical theory on the American stock market, has provided a confirmation of the buoyancy of the stock market. And the latest explosion in stock prices has thrown a little cold water on what had been risi...",The New York Times,[u'STOCKS AND BONDS'],http://www.nytimes.com/1989/04/20/business/market-place-surge-confirmed-by-dow-theory.html,4/20/89,News,4fd199e58eb7c8105d6aa3cfWisconsin Blue Cross Succeeds as a Business,Opinion,[],153,LEAD: To the Editor:...,The New York Times,"[u'HEALTH INSURANCE', u'MEDICINE AND HEALTH']",http://www.nytimes.com/1989/04/20/opinion/l-wisconsin-blue-cross-succeeds-as-a-business-323089.html,4/20/89,Letter,4fd18af18eb7c8105d68d279BUSINESS DIGEST,Business,[],583,LEAD:  The Economy...,The New York Times,[],http://www.nytimes.com/1989/04/20/business/business-digest-574089.html,4/20/89,Summary,4fd194ff8eb7c8105d6a09cbBUSINESS DIGEST,Business,[],642,"LEAD:  INTERNATIONAL  West Germany stunned the world's financial markets by announcing it would raise its key interest rates. Intended to reduce inflationary pressures, the surprise step upset stock and bond markets and fueled fears that other ind...",The New York Times,[],http://www.nytimes.com/1989/04/21/business/business-digest-871889.html,4/21/89,Summary,4fd192ff8eb7c8105d69cc14U.S. Displays Muted Concern on German Move,Business,"[u'WEST GERMANY', u'UNITED STATES']",714,"LEAD: West Germany's interest-rate increases might ''lead to a small reduction in the dollar,'' a senior Administration official said today. And ''it's unlikely that the Fed will respond,'' he added....",The New York Times,[u'CREDIT'],http://www.nytimes.com/1989/04/21/business/us-displays-muted-concern-on-german-move.html,4/21/89,News,4fd18af58eb7c8105d68d66cEconomic Scene; Post-Crash High Is Hard to Explain,Business,[],978,"LEAD: THE rise in consumer prices by five-tenths of 1 percent, bringing the first quarter in at an inflation rate of 6.1 percent, did not fluster the stock market. Quite the contrary: the market soared to a post-crash high....",The New York Times,"[u'RECESSION AND DEPRESSION', u'UNITED STATES ECONOMY', u'FORECASTS', u'STOCKS AND BONDS', u'STOCK PRICES AND TRADING VOLUME']",http://www.nytimes.com/1989/04/21/business/economic-scene-post-crash-high-is-hard-to-explain.html,4/21/89,News,4fd192ff8eb7c8105d69cc10Foreign Aid Deals Said to Cost $1 Billion Yearly in Exports,Business,[u'UNITED STATES'],427,"LEAD: American industry is losing exports approaching $1 billion a year because foreign governments are increasingly using foreign aid as a means of expanding their own exports, the Bush Administration told Congress in an interagency study deliver...",The New York Times,"[u'INTERNATIONAL TRADE AND WORLD MARKET', u'FOREIGN AID']",http://www.nytimes.com/1989/04/21/business/foreign-aid-deals-said-to-cost-1-billion-yearly-in-exports.html,4/21/89,News,4fd195058eb7c8105d6a0e4aTHE WORLD: Incentives for Warsaw; Washington Offers Help for a Price,Washington; Week in Review,[u'POLAND'],728,"LEAD: PRESIDENT BUSH signaled last week that Washington is willing to take a chance on Poland, but only if Poland is willing to accept economic changes that give a much freer rein to private enterprise....",The New York Times,"[u'UNITED STATES INTERNATIONAL RELATIONS', u'POLAND-INTERNATIONAL RELATIONS-US', u'INCOME', u'CREDIT', u'ECONOMIC CONDITIONS AND TRENDS']",http://www.nytimes.com/1989/04/23/weekinreview/the-world-incentives-for-warsaw-washington-offers-help-for-a-price.html,4/23/89,News,4fd180c68eb7c8105d67cf10Bonn's Rate Move Rattles Confidence,Business,[u'WEST GERMANY'],974,"LEAD: A surprise from West Germany took some of the conviction out of the widespread belief that inflation in the world economy might be stabilizing and interest rates might ease. Saying it wanted to curb inflationary pressures, the Bundesbank rai...",The New York Times,"[u'INTEREST (MONEY)', u'CREDIT']",http://www.nytimes.com/1989/04/23/business/week-in-business-bonn-s-rate-move-rattles-confidence.html,4/23/89,News,4fd188558eb7c8105d688b34DANGEROUS DAYS IN THE MACARENA,Magazine,"[u'COLOMBIA', u'SERRANIA DE LA MACARENA (COLOMBIA)']",4018,"LEAD: IT'S AN INCALCULABLY valuable national treasure,'' Dr. Carlos Castano, the director of Colombia's national parks, had told me. Yet when I had said that I intended to visit the country's oldest and, among scientists, most internationally cele...",The New York Times,"[u'SOCIAL CONDITIONS AND TRENDS', u'VIOLENCE', u'NATURAL RESOURCES', u'DRUG TRAFFIC', u'POLITICS AND GOVERNMENT', u'ECONOMIC CONDITIONS AND TRENDS', u'CULTURE']",http://www.nytimes.com/1989/04/23/magazine/dangerous-days-in-the-macarena.html,4/23/89,News,4fd193018eb7c8105d69cd41Lag in New York Region Raising Vulnerability to a U.S. Recession,Front Page; New York and Region,[u'NEW YORK CITY METROPOLITAN AREA'],2069,"LEAD: An economic slowdown is in progress throughout the New York metropolitan area, damaging many businesses and making New York City and its suburbs more vulnerable in a nationwide downturn than they have been since the 1970's....",The New York Times,"[u'RECESSION AND DEPRESSION', u'BUILDING (CONSTRUCTION)', u'FORECASTS', u'STOCKS AND BONDS', u'ECONOMIC CONDITIONS AND TRENDS']",http://www.nytimes.com/1989/04/24/nyregion/lag-in-new-york-region-raising-vulnerability-to-a-us-recession.html,4/24/89,News,4fd18af28eb7c8105d68d3c9Ford and G.M. Foresee 6-Month Cut in Output,Business,[u'UNITED STATES'],642,"LEAD: Suffering from softer car and truck sales, the nation's two largest auto makers are trimming production plans for the next six months in an effort to reduce bloated inventories of cars and trucks....",The New York Times,"[u'AUTOMOBILES', u'TRUCKS AND TRUCKING', u'PRODUCTION']",http://www.nytimes.com/1989/04/25/business/ford-and-gm-foresee-6-month-cut-in-output.html,4/25/89,News,4fd183278eb7c8105d680ec6Takeshita Undone by System That He Lived By for So Long,World; Front Page,[u'JAPAN'],1479,"LEAD: When Noboru Takeshita took office as Prime Minister 17 months ago, he brought with him a reputation as the insider's insider, a product of the clubby, arcane world of Japanese politics....",The New York Times,"[u'SUSPENSIONS, DISMISSALS AND RESIGNATIONS', u'ETHICS', u'BIOGRAPHICAL INFORMATION', u'BRIBERY']",http://www.nytimes.com/1989/04/26/world/takeshita-undone-by-system-that-he-lived-by-for-so-long.html,4/26/89,News,4fd195008eb7c8105d6a0af0"Dow Drops 15.77 More, Ending at 2,386.91",Business,[],578,"LEAD: The stock market fell again yesterday, with much of the decline coming in oil issues....",The New York Times,"[u'STOCKS AND BONDS', u'DOW JONES STOCK AVERAGE', u'STOCK PRICES AND TRADING VOLUME']",http://www.nytimes.com/1989/04/26/business/dow-drops-15.77-more-ending-at-2386.91.html,4/26/89,News,4fd1a2e18eb7c8105d6b99c0BUSINESS DIGEST,Business,[],589,LEAD:  Companies...,The New York Times,[],http://www.nytimes.com/1989/04/26/business/business-digest-161389.html,4/26/89,Summary,4fd192fb8eb7c8105d69c84cEconomic Scene; Burger Flippers Take the Heat,Business,[u'UNITED STATES'],796,"LEAD: AS America's white-collar elite grows rich, must the poor and near-poor be left behind?...",The New York Times,"[u'LABOR', u'WAGES AND SALARIES', u'INCOME']",http://www.nytimes.com/1989/04/26/business/economic-scene-burger-flippers-take-the-heat.html,4/26/89,News,4fd183208eb7c8105d6808e7Interest Rates Being Held Steady Amid Signs of Slowing Economy,Front Page; Business,[u'UNITED STATES'],1578,LEAD: Ranking officials of the Federal Reserve acknowledged this week that it had stopped pushing interest rates up because of recent signs that the nation's economy might be slowing significantly....,The New York Times,"[u'UNITED STATES ECONOMY', u'CREDIT']",http://www.nytimes.com/1989/04/27/business/interest-rates-being-held-steady-amid-signs-of-slowing-economy.html,4/27/89,News,4fd1a20a8eb7c8105d6b8326BUSINESS DIGEST,Business,[],618,"LEAD:  THE ECONOMY  The Federal Reserve has stopped pushing interest rates up because of recent signs that the economy might be slowing, top officials acknowledge.  [ Page A1. ]  The economy slowed modestly to a 3 percent rate of growth in the fir...",The New York Times,[],http://www.nytimes.com/1989/04/27/business/business-digest-476889.html,4/27/89,Summary,4fd1a2e78eb7c8105d6b9e0eMarket Place; Surge in Stocks Has Its Doubters,Business,[u'UNITED STATES'],895,"LEAD: HAPPY days ought to be here again, at least to judge from the action of stock prices. But good times haven't returned to Wall Street, where the talk is more of possible layoffs than of stocks that are likely to double....",The New York Times,"[u'LAYOFFS (LABOR)', u'STOCKS AND BONDS', u'BROKERS AND BROKERAGE FIRMS', u'STOCK PRICES AND TRADING VOLUME']",http://www.nytimes.com/1989/04/28/business/market-place-surge-in-stocks-has-its-doubters.html,4/28/89,News,4fd194ff8eb7c8105d6a0a1dAn Electronics Chain's Sharp Slide,Business,[],1350,"LEAD: Early in this decade the consumer electronics industry was riding high, with sales, spurred by videocassette recorders and microwave ovens, advancing smartly each year. But with increasing competition and a lack of new products, the industry...",The New York Times,"[u'SALES', u'COMPANY AND ORGANIZATION PROFILES', u'ELECTRONICS', u'FINANCES']",http://www.nytimes.com/1989/04/29/business/an-electronics-chain-s-sharp-slide.html,4/29/89,News,4fd183248eb7c8105d680c7e"BUSINESS DIGEST: SATURDAY, APRIL 29, 1989",Business,[],622,LEAD:  International...,The New York Times,[],http://www.nytimes.com/1989/04/29/business/business-digest-saturday-april-29-1989.html,4/29/89,Summary,4fd192fe8eb7c8105d69cb95Surprise Dollar Rise Brings Central Bank Intervention,Business,[],790,"LEAD: The Federal Reserve and several other central banks sold dollars yesterday, trying to stop a rally of the dollar that has surprised many traders and economists....",The New York Times,[u'CURRENCY'],http://www.nytimes.com/1989/04/29/business/currency-markets-surprise-dollar-rise-brings-central-bank-intervention.html,4/29/89,News,4fd1a2098eb7c8105d6b826d"For Soviet Athletes, A Greater Presence In American Sports",World; Washington,"[u'UNITED STATES', u'UNION OF SOVIET SOCIALIST REPUBLICS (USSR)']",1797,"LEAD: They are arriving in the United States in increasing numbers and participating in a wider variety of sports, amateur and professional athletes from the Soviet Union doing their part to make perestroika a success. It is a friendly invasion an...",The New York Times,"[u'UNITED STATES INTERNATIONAL RELATIONS', u'REFORM AND REORGANIZATION', u'INTERNATIONAL RELATIONS', u'ATHLETICS AND SPORTS']",http://www.nytimes.com/1989/04/30/world/for-soviet-athletes-a-greater-presence-in-american-sports.html,4/30/89,News,4fd188538eb7c8105d688a4eMobil Getting Out Of South Africa,Business,[],1053,LEAD: Mobil is pulling out of South Africa. The oil giant has the largest South African operations of any American company and has been in South Africa for more than 90 years. Mobil's refinery and marketing network are being sold for an undisclose...,The New York Times,[],http://www.nytimes.com/1989/04/30/business/week-in-business-mobil-getting-out-of-south-africa.html,4/30/89,News,4fd1a2e78eb7c8105d6b9d3cEurope's Agonizing Over Japan,Business,"[u'JAPAN', u'ITALY', u'GREAT BRITAIN', u'FRANCE']",2422,"LEAD: Europeans have long feuded over whether to put out a ''Welcome'' mat or a ''Keep Out'' sign for Japanese business. But a recent surge in Japanese investment, especially in Britain, has raised to new heights the emotional debate over whether ...",The New York Times,"[u'FOREIGN INVESTMENTS', u'INTERNATIONAL TRADE AND WORLD MARKET', u'ECONOMIC CONDITIONS AND TRENDS']",http://www.nytimes.com/1989/04/30/business/europe-s-agonizing-over-japan.html,4/30/89,News,4fd192ff8eb7c8105d69cbb7Cashing In on European Integration,Business,[],863,LEAD: Investors hoping to gain from the dismantling of the European Community's internal economic barriers are finding they need not wait for the program's 1992 deadline....,The New York Times,"[u'INVESTMENT STRATEGIES', u'STOCKS AND BONDS']",http://www.nytimes.com/1989/04/30/business/investing-cashing-in-on-european-integration.html,4/30/89,News,4fd1a2968eb7c8105d6b94b5Business Digest,Business,[],730,"LEAD:  The Media Business  WPP Group has begun an assault on another U.S. ad agency, making an unsolicited $730 million offer to buy the Ogilvy Group. If the bid succeeds, it will create the world's second-largest advertising company, after Saatch...",The New York Times,[],http://www.nytimes.com/1989/05/01/business/business-digest-522089.html,5/1/89,Summary,4fd183c58eb7c8105d682094After a Decade of Thatcher Are Her Ideals Now Britain's?,World; Front Page,[u'GREAT BRITAIN'],1728,"LEAD: Ten years ago, Britain was the sick man of Europe, its industries crumbling, its economy paralyzed by intractable labor disputes, its political and intellectual leaders resigned to genteel but inevitable decline....",The New York Times,"[u'REFORM AND REORGANIZATION', u'PUBLIC OPINION']",http://www.nytimes.com/1989/05/02/world/after-a-decade-of-thatcher-are-her-ideals-now-britain-s.html,5/2/89,News,4fd1a28c8eb7c8105d6b8f76Warning On Trade 'Bashing',Business,"[u'JAPAN', u'UNITED STATES']",965,"LEAD: President Bush's chief economist, Michael J. Boskin, warned today that ''bashing'' trade partners like Japan could lead to a trade war and a recession....",The New York Times,"[u'INTERNATIONAL TRADE AND WORLD MARKET', u'UNITED STATES ECONOMY']",http://www.nytimes.com/1989/05/02/business/warning-on-trade-bashing.html,5/2/89,News,4fd185858eb7c8105d684e20"Dow Down 3.84 Points, Closing at 2,414.96",Business,[],492,LEAD: Stocks retreated yesterday in a decline that traders attributed to renewed concern that the Federal Reserve Board might be forced to tighten interest rates....,The New York Times,"[u'STOCKS AND BONDS', u'DOW JONES STOCK AVERAGE', u'STOCK PRICES AND TRADING VOLUME']",http://www.nytimes.com/1989/05/02/business/dow-down-3.84-points-closing-at-2414.96.html,5/2/89,News,4fd194ff8eb7c8105d6a0a47Cheney Remarks on Soviet Future Ruffle the White House's Feathers,Front Page; U.S.; Washington,[u'UNION OF SOVIET SOCIALIST REPUBLICS (USSR)'],1028,"LEAD: President Bush dissociated himself today from remarks by Defense Secretary Dick Cheney about Soviet reform, the second time in a week that the White House has indicated chagrin over comments from the outspoken Pentagon chief....",The New York Times,"[u'UNITED STATES INTERNATIONAL RELATIONS', u'REFORM AND REORGANIZATION', u'ECONOMIC CONDITIONS AND TRENDS']",http://www.nytimes.com/1989/05/02/us/cheney-remarks-on-soviet-future-ruffle-the-white-house-s-feathers.html,5/2/89,News,4fd1a63e8eb7c8105d6bff9fSUBSIDY ON WHEAT FOR SOVIET SALES APPROVED BY BUSH,Front Page; Business; Washington,"[u'EUROPE', u'UNION OF SOVIET SOCIALIST REPUBLICS (USSR)']",975,"LEAD: President Bush, who has argued against farm trade subsidies and urged that they be curtailed worldwide, approved Government subsidies today on the sale of 1.5 million metric tons of wheat to the Soviet Union....",The New York Times,"[u'SALES', u'UNITED STATES INTERNATIONAL RELATIONS', u'INTERNATIONAL RELATIONS', u'INTERNATIONAL TRADE AND WORLD MARKET', u'CROP CONTROLS AND SUBSIDIES', u'GRAIN', u'US-INTERNATIONAL RELATIONS-USSR']",http://www.nytimes.com/1989/05/03/business/subsidy-on-wheat-for-soviet-sales-approved-by-bush.html,5/3/89,News,4fd185818eb7c8105d684bccBUSINESS DIGEST,Business,[],626,LEAD:  INTERNATIONAL  President Bush approved Government subsidies on the sale of 1.5 million metric tons of wheat to the Soviet Union. Mr. Bush has often argued against farm trade subsidies. [ Page A1. ] The G.A.O. said the technology the U.S. is...,The New York Times,[],http://www.nytimes.com/1989/05/03/business/business-digest-053289.html,5/3/89,Summary,4fd194fc8eb7c8105d6a07c6Dollar Steady Amid Selling,Business,[u'UNITED STATES'],310,LEAD: The dollar held firm yesterday in the face of dollar selling by central banks....,AP,"[u'INTERNATIONAL MONETARY SYSTEM', u'PRICES', u'CURRENCY']",http://www.nytimes.com/1989/05/04/business/currency-markets-dollar-steady-amid-selling.html,5/4/89,News,4fd195008eb7c8105d6a0b33BUSINESS DIGEST,Business,[],601,LEAD:  International...,The New York Times,[],http://www.nytimes.com/1989/05/04/business/business-digest-348189.html,5/4/89,Summary,4fd195008eb7c8105d6a0b23Fed Says Growth Is Slowing,Business,[],629,"LEAD: In a development that seems likely to solidify Federal Reserve opposition to further increases in interest rates in the near term, a new nationwide survey by the central bank finds little inflationary pressure from wages or other manufacturi...",The New York Times,"[u'LABOR', u'UNITED STATES ECONOMY', u'PRICES', u'CREDIT']",http://www.nytimes.com/1989/05/04/business/fed-says-growth-is-slowing.html,5/4/89,News,4fd1a28d8eb7c8105d6b9066Economic Scene; A New Warning On the Deficits,Business,[u'UNITED STATES'],891,"LEAD: THE Federal Reserve Bank of New York, in its 74th annual report, just warned that the United States budget and trade deficits pose a clear and increasing risk to the nation's and the world's economic stability. E. Gerald Corrigan, president ...",The New York Times,"[u'UNITED STATES ECONOMY', u'FINANCES', u'BUDGETS AND BUDGETING', u'ECONOMIC CONDITIONS AND TRENDS']",http://www.nytimes.com/1989/05/05/business/economic-scene-a-new-warning-on-the-deficits.html,5/5/89,News,4fd184138eb7c8105d682991