headline,section,locations,word_count,snippet,source,subjects,url,date,type,idThe Bulk-for-Benefits Deal in Zoning,Real Estate,[u'NEW YORK CITY'],2509,"LEAD: ALMOST 30 years after New York City rewrote its land-use policies and pioneered a controversial strategy of exchanging zoning bonuses for public amenities, its incentive zoning approach is being buffeted by a fresh round of criticism from pu...",The New York Times,"[u'BUILDING (CONSTRUCTION)', u'ZONING']",http://www.nytimes.com/1989/07/23/realestate/the-bulk-for-benefits-deal-in-zoning.html,7/23/89,News,4fd18d918eb7c8105d691fcbDriving New England's Historic Coast,Travel,"[u'PORTSMOUTH (NH)', u'MAINE', u'YORK (ME)', u'NEW HAMPSHIRE']",3175,"LEAD: ''YORK HARBOR is only a half hour from Portsmouth and it is a beautiful little sea-side village. In fact everything on this coast is beautiful, and the neatness and self-respect of New England is more amazing than ever.''...",The New York Times,[u'TRAVEL AND VACATIONS'],http://www.nytimes.com/1989/07/23/travel/driving-new-england-s-historic-coast.html,7/23/89,News,4fd195468eb7c8105d6a1197Social Security Faces a $60 Billion Question,Business,[],1579,"LEAD: The Social Security Trust Fund, on the verge of bankruptcy six years ago, has grown so robustly as a result of changes adopted then - tighter benefits and accelerated payroll tax increases - that it will run a surplus of close to $60 billion...",The New York Times,[u'SOCIAL SECURITY (US)'],http://www.nytimes.com/1989/07/23/business/social-security-faces-a-60-billion-question.html,7/23/89,News,4fd18d918eb7c8105d691fcdInflation Shows Signs of Easing,Business,[],829,"LEAD: Inflation eased in June, with consumer prices rising only two-tenths of 1 percent. That is the smallest increase in 16 months and is sharply lower than the six-tenths of 1 percent rise in May. Prices of energy and clothing declined in June a...",The New York Times,[u'NO INDEX TERMS'],http://www.nytimes.com/1989/07/23/business/week-in-business-inflation-shows-signs-of-easing.html,7/23/89,News,4fd18d918eb7c8105d691fd7A Novel Test for an Old Soviet Industry,World,[u'UNION OF SOVIET SOCIALIST REPUBLICS (USSR)'],1136,"LEAD: The promise of a planned economy, whatever its shortcomings, is the security of a certain orderliness. But since Mikhail S. Gorbachev came to power four years ago, Vladimir A. Yamnikov, the stocky 49-year-old manager of the Kristall vodka di...",The New York Times,"[u'SALES', u'REFORM AND REORGANIZATION', u'INTERNATIONAL TRADE AND WORLD MARKET', u'COMPANY AND ORGANIZATION PROFILES', u'PRICES', u'INDUSTRY PROFILES', u'VODKA', u'ECONOMIC CONDITIONS AND TRENDS', u'LIQUOR', u'NEW MODELS, DESIGN AND PRODUCTS', u'PRODUCTION']",http://www.nytimes.com/1989/07/23/world/a-novel-test-for-an-old-soviet-industry.html,7/23/89,News,4fd196368eb7c8105d6a3018The Stanley Works Goes Global,Business,[],2633,"LEAD: Globalization - making factories abroad as important as those at home - has become a familiar strategy for the I.B.M.'s, Du Pont's and Ford's of America. But now it is penetrating to the second tier of American manufacturers and making those...",The New York Times,[u'COMPANY AND ORGANIZATION PROFILES'],http://www.nytimes.com/1989/07/23/business/the-stanley-works-goes-global.html,7/23/89,News,4fd1a6808eb7c8105d6c0756Just A Brief Rally?,Business,[],1352,"LEAD: Lines of eager investors have not formed outside brokerage firm offices yet, nor are telephones on Wall Street ringing madly. And almost no one is talking about stocks at this summer's parties, as they were two years ago....",The New York Times,"[u'STOCKS AND BONDS', u'STOCK PRICES AND TRADING VOLUME']",http://www.nytimes.com/1989/07/23/business/just-a-brief-rally.html,7/23/89,News,4fd1a7e68eb7c8105d6c2fadBusiness Digest,Business,[],593,LEAD:  International...,The New York Times,[u'NO INDEX TERMS'],http://www.nytimes.com/1989/07/24/business/business-digest-081389.html,7/24/89,Summary,4fd184528eb7c8105d683185Mexico and Banks Reach Accord to Lower Debt; Agreement Is Made As Skepticism Rises About U.S. Policy,Front Page; Business,"[u'LATIN AMERICA', u'UNITED STATES', u'MEXICO']",2739,"LEAD: When Treasury Secretary Nicholas F. Brady outlined a proposal in March to attack the intractable third world debt problem, he raised hopes in countries like Mexico, Venezuela, Brazil and Argentina that something was finally being done to hel...",The New York Times,"[u'CREDIT', u'ECONOMIC CONDITIONS AND TRENDS', u'THIRD WORLD AND DEVELOPING COUNTRIES']",http://www.nytimes.com/1989/07/24/business/mexico-banks-reach-accord-lower-debt-agreement-made-skepticism-rises-about-us.html,7/24/89,Series,4fd185e18eb7c8105d685aa7Syrian Hopes for Oil Tempered by Setback,Business,[u'SYRIA'],1132,"LEAD: Arthur and Mia from the Channel Islands, who entertain at a nightclub here, swung into a country and western tune recently, and the audience, including some Americans who work in the oil business here, joined in....",The New York Times,"[u'INTERNATIONAL TRADE AND WORLD MARKET', u'OIL (PETROLEUM) AND GASOLINE', u'ECONOMIC CONDITIONS AND TRENDS', u'PRODUCTION']",http://www.nytimes.com/1989/07/24/business/international-report-syrian-hopes-for-oil-tempered-by-setback.html,7/24/89,News,4fd1a6428eb7c8105d6c0383Trade Meeting Focuses On Tourism and Travel,Travel; Business,[],587,"LEAD: International talks intended to reduce protectionism in tourism and transportation began last week, with much enthusiasm for change but a widespread reluctance to dismantle barriers....",The New York Times,"[u'INTERNATIONAL TRADE AND WORLD MARKET', u'TRANSPORTATION', u'PROTECTIONISM (TRADE)', u'TRAVEL AND VACATIONS']",http://www.nytimes.com/1989/07/24/business/trade-meeting-focuses-on-tourism-and-travel.html,7/24/89,News,4fd1954e8eb7c8105d6a173aMexico Feels Squeeze of Years of Austerity,Front Page; Business,[u'MEXICO'],2723,"LEAD: Seven years after the Latin American debt crisis erupted here, Mexico is a country battered by debt-induced austerity, in which the $100 billion owed to foreign creditors is likely to remain the dominant factor in the nation's economic and p...",The New York Times,"[u'SURVEYS AND SERIES', u'FINANCES', u'CREDIT', u'ECONOMIC CONDITIONS AND TRENDS', u'BANKS AND BANKING']",http://www.nytimes.com/1989/07/25/business/mexico-feels-squeeze-of-years-of-austerity.html,7/25/89,Series,4fd196368eb7c8105d6a3047Energy Prices Off Sharply As Supplies Remain High,Business,[u'UNITED STATES'],406,LEAD: Energy futures prices fell sharply on the New York Mercantile Exchange yesterday on indications that demand for crude oil products is declining while supplies remain high....,AP,"[u'ENERGY AND POWER', u'PRICES', u'OIL (PETROLEUM) AND GASOLINE', u'FUTURES TRADING']",http://www.nytimes.com/1989/07/25/business/futures-options-energy-prices-off-sharply-as-supplies-remain-high.html,7/25/89,News,4fd196368eb7c8105d6a3051Global Expansion Seen At Midland Montague,Business,[],418,"LEAD: While American securities dealers continue to cut their staffs, legions of Wall Street economists, traders and salespeople have found new employers among the foreign firms expanding into the American market....",The New York Times,"[u'APPOINTMENTS AND EXECUTIVE CHANGES', u'MERGERS, ACQUISITIONS AND DIVESTITURES']",http://www.nytimes.com/1989/07/25/business/business-people-global-expansion-seen-at-midland-montague.html,7/25/89,News,4fd195478eb7c8105d6a11c6Business Digest,Business,[],559,LEAD:  Economy...,The New York Times,[u'NO INDEX TERMS'],http://www.nytimes.com/1989/07/26/business/business-digest-599789.html,7/26/89,Summary,4fd1a7e58eb7c8105d6c2ecb"Big Latin Debtors Find That Lacking Austerity, Relief Is Not Coming Soon",World,"[u'LATIN AMERICA', u'BRAZIL', u'ARGENTINA', u'MEXICO', u'PERU']",2562,LEAD: A photograph printed in newspapers across Brazil recently crystallized the view held by many Latin Americans that the developed world ignores their debt crisis....,The New York Times,"[u'REFORM AND REORGANIZATION', u'SURVEYS AND SERIES', u'FINANCES', u'CREDIT', u'ECONOMIC CONDITIONS AND TRENDS', u'THIRD WORLD AND DEVELOPING COUNTRIES']",http://www.nytimes.com/1989/07/26/world/big-latin-debtors-find-that-lacking-austerity-relief-is-not-coming-soon.html,7/26/89,Series,4fd195458eb7c8105d6a108eDurables Orders Rose 0.3% in June,Business,[],478,"LEAD: Orders for big-ticket factory goods rose three-tenths of 1 percent in June, the Government said today in a report seen by some analysts as evidence that manufacturing, although sluggish, is not crumbling....",The New York Times,[u'UNITED STATES ECONOMY'],http://www.nytimes.com/1989/07/26/business/durables-orders-rose-0.3-in-june.html,7/26/89,News,4fd195458eb7c8105d6a1094Business Digest,Business,[],486,LEAD:  Economy...,The New York Times,[u'NO INDEX TERMS'],http://www.nytimes.com/1989/07/27/business/business-digest-917789.html,7/27/89,Summary,4fd184508eb7c8105d682f63Bush Signs Bill Ending Gas Controls,Business,[u'UNITED STATES'],722,LEAD: President Bush today signed a law removing the last price controls on natural gas and then pledged to develop a comprehensive strategy for enhancing the nation's energy security....,The New York Times,"[u'GAS (FUEL)', u'WAGE AND PRICE CONTROLS', u'LAW AND LEGISLATION', u'REGULATION AND DEREGULATION OF INDUSTRY']",http://www.nytimes.com/1989/07/27/business/bush-signs-bill-ending-gas-controls.html,7/27/89,News,4fd185de8eb7c8105d685786Everything That's Right About the National Debt,Arts; Books,[],1012,LEAD:  The Debt and the Deficit  False Alarms/Real Possibilities  By Robert Heilbroner and Peter Bernstein  Illustrated with tables. 144 pages. W. W. Norton....,The New York Times,[u'BOOK REVIEWS'],http://www.nytimes.com/1989/07/27/books/books-of-the-times-everything-that-s-right-about-the-national-debt.html,7/27/89,Review,4fd18d958eb7c8105d69228eFrankfurt's High-Rise Debate,Business,[u'FRANKFURT (WEST GERMANY)'],1372,"LEAD: As continental Europe's leading financial center, Frankfurt am Main already sported enough gleaming skyscapers to have been dubbed ''Mainhattan'' and ''Bankfurt'' by critics of its rapid growth. Now, however, a high-rise construction boom fe...",The New York Times,"[u'REAL ESTATE', u'ECONOMIC CONDITIONS AND TRENDS', u'OFFICE BUILDINGS']",http://www.nytimes.com/1989/07/28/business/frankfurt-s-high-rise-debate.html,7/28/89,News,4fd1a6bb8eb7c8105d6c0e93Treasury Notes and Bonds Surge,Business,[u'UNITED STATES'],1067,"LEAD: In a sharp rally, prices of Treasury notes and bonds surged in brisk trading yesterday, in response to Government economic reports. First, data showed that economic growth in the second quarter was somewhat weaker than anticipated, then the ...",The New York Times,"[u'AUCTIONS', u'FINANCES', u'GOVERNMENT BONDS']",http://www.nytimes.com/1989/07/28/business/credit-markets-treasury-notes-and-bonds-surge.html,7/28/89,News,4fd1844d8eb7c8105d682c93Prices Plunge in Reaction To Bearish Economic Data,Business,[],550,"LEAD: Prices of commodity futures tumbled yesterday as traders of gold, crude oil, soybeans and coffee reacted to bearish signals ranging from signs of an economic slowdown to ideal Corn Belt growing conditions....",AP,"[u'OIL (PETROLEUM) AND GASOLINE', u'GOLD', u'FUTURES TRADING', u'COFFEE', u'SOYBEANS']",http://www.nytimes.com/1989/07/29/business/futures-options-prices-plunge-in-reaction-to-bearish-economic-data.html,7/29/89,News,4fd1a6848eb7c8105d6c0a31"Farmers Gain, and Deere Revives",Business,[],1547,"LEAD: At Arends Brothers, a Deere & Company farm-equipment dealership here, demand for new four-wheel-drive tractors is so brisk that customers who order today will have to wait until September for delivery. Arends salesmen, who for years had to r...",The New York Times,"[u'AGRICULTURE', u'COMPANY REPORTS']",http://www.nytimes.com/1989/07/29/business/farmers-gain-and-deere-revives.html,7/29/89,News,4fd1a6be8eb7c8105d6c1147"BUSINESS DIGEST: SATURDAY, JULY 29, 1989",Business,[],640,LEAD:  Companies...,The New York Times,[u'NO INDEX TERMS'],http://www.nytimes.com/1989/07/29/business/business-digest-saturday-july-29-1989.html,7/29/89,News,4fd185de8eb7c8105d68584dThatcher's Britain Is the Model for 1992,Business,[u'GREAT BRITAIN'],1085,LEAD: The aim of Europe 1992 is to create a single large market in which increased competition will drive down prices and offer more choice to consumers. We call this the single market. I would like to explain why I think it will be good for Europ...,The New York Times,[],http://www.nytimes.com/1989/07/30/business/business-forum-europe-s-single-market-thatcher-s-britain-is-the-model-for-1992.html,7/30/89,News,4fd1a6bd8eb7c8105d6c0fc1L.A. FIGHTS FOR BREATH,Magazine,[u'LOS ANGELES (CALIF)'],4828,"LEAD: THE POLITICIAN HAD JUST DESCRIBED HOW the new master plan to cleanse the grimy air over metropolitan Los Angeles imperils industry. Now he started on what he called its invasions of everyday life - restrictions on housepaint, deodorant, barb...",The New York Times,[u'AIR POLLUTION'],http://www.nytimes.com/1989/07/30/magazine/la-fights-for-breath.html,7/30/89,News,4fd18d938eb7c8105d69211dRICH MAKES HIS PITCH,Magazine,[u'BUFFALO (NY)'],2968,"LEAD: IN 1983, THEIR FIRST SEASON under the ownership of Robert E. Rich Jr., the Buffalo Bisons' most notorious promotion at decrepit War Memorial Stadium was ''Unemployment Night,'' a bit of gallows humor about the recession that flattened smokes...",The New York Times,"[u'BASEBALL', u'MAJOR LEAGUES']",http://www.nytimes.com/1989/07/30/magazine/rich-makes-his-pitch.html,7/30/89,News,4fd185db8eb7c8105d6855baDeutsche Bank's Bigger Reach,Business,[],2672,"LEAD: ''Almighty Supreme Being,'' the West German press often calls him....",The New York Times,[u'COMPANY AND ORGANIZATION PROFILES'],http://www.nytimes.com/1989/07/30/business/deutsche-bank-s-bigger-reach.html,7/30/89,News,4fd1a6818eb7c8105d6c085eA Burned-Out Light Bulb and Other Tragedies,Magazine,[u'POLAND'],3007,"LEAD: WHEN I LEFT POLAND IN 1981, to attend the opening of my play ''Cinders'' at the Royal Court Theater in London, I was sure I would be back in Warsaw in two weeks. It was a period of great hope. Gen. Wojciech Jaruzelski, the Communist Party le...",The New York Times,[],http://www.nytimes.com/1989/07/30/magazine/warsaw-scenes-a-burned-out-light-bulb-and-other-tragedies.html,7/30/89,News,4fd185db8eb7c8105d6855b9Soviet Business Consultants Sharpen Hammer and Sickle,World,[u'UNION OF SOVIET SOCIALIST REPUBLICS (USSR)'],1625,"LEAD: He is 31 years old, he drives a pricey imported car, his tastes in clothing run to European-cut suits and yellow ''power'' ties, and his notion of a fringe benefit is paying tennis-court fees for his staff. Aleksandr I. Rubtsov is the Soviet...",The New York Times,"[u'EXECUTIVES AND MANAGEMENT', u'CONSULTANTS', u'ECONOMIC CONDITIONS AND TRENDS']",http://www.nytimes.com/1989/07/30/world/soviet-business-consultants-sharpen-hammer-and-sickle.html,7/30/89,News,4fd195488eb7c8105d6a12ee"Desperate, Latin Nations Discover the Free Market",Week in Review,[u'LATIN AMERICA'],840,"LEAD: IN Latin America, where governments of the right, left and center have long intervened in the economy, an intense new interest in the idea of the free market is growing....",The New York Times,"[u'ECONOMIC CONDITIONS AND TRENDS', u'REGULATION AND DEREGULATION OF INDUSTRY']",http://www.nytimes.com/1989/07/30/weekinreview/the-world-desperate-latin-nations-discover-the-free-market.html,7/30/89,News,4fd196388eb7c8105d6a3169Fostering America's Interests Abroad. . .,Business,[],758,LEAD: The 1980's has been a difficult decade for the World Bank. The early Reagan Administration shunned the official agency as an international welfare bureaucracy. Then the bank's reputation was hurt when a turbulent global economy shattered dev...,The New York Times,"[u'CREDIT', u'THIRD WORLD AND DEVELOPING COUNTRIES']",http://www.nytimes.com/1989/07/30/business/business-forum-the-world-bank-fostering-america-s-interests-abroad.html,7/30/89,News,4fd196388eb7c8105d6a3168Mexico Sees Gains in Debt Accord,Business,[u'MEXICO'],1154,"LEAD: With a debt-reduction agreement in his pocket after seven months of difficult negotiations, President Carlos Salinas de Gortari is seeking to convince Mexican and foreign investors that the accord is not just another debt rescheduling but th...",The New York Times,"[u'FOREIGN INVESTMENTS', u'CREDIT', u'ECONOMIC CONDITIONS AND TRENDS']",http://www.nytimes.com/1989/07/31/business/international-report-mexico-sees-gains-in-debt-accord.html,7/31/89,News,4fd184538eb7c8105d6831e4Yields Expected to Drop Further,Business,[],887,LEAD: Credit market analysts expect Treasury bond yields to decline further in coming weeks. The yields fell below 8 percent for the first time in two years on Friday....,The New York Times,"[u'CREDIT', u'STOCKS AND BONDS', u'BOND PRICES AND TRADING VOLUME', u'GOVERNMENT BONDS']",http://www.nytimes.com/1989/07/31/business/credit-markets-yields-expected-to-drop-further.html,7/31/89,News,4fd1954e8eb7c8105d6a17c5Economic Watch; Western Credit for Moscow? Experts Are Split on Impact,Front Page; Business,[u'UNION OF SOVIET SOCIALIST REPUBLICS (USSR)'],1654,LEAD: Moscow has succeeded in coaxing striking miners back to the coal fields with a package of benefits reportedly worth $8 billion annually. But the miners' economic grievances were no greater than those of tens of millions of other Soviet worke...,The New York Times,"[u'FINANCES', u'CREDIT', u'BUDGETS AND BUDGETING', u'ECONOMIC CONDITIONS AND TRENDS']",http://www.nytimes.com/1989/07/31/business/economic-watch-western-credit-for-moscow-experts-are-split-on-impact.html,7/31/89,News,4fd1a6438eb7c8105d6c0420Helping Gorby Succeed,Opinion,[u'UNION OF SOVIET SOCIALIST REPUBLICS (USSR)'],748,"LEAD: What's the matter with you right-wingers, ask the liberal editorialists; don't you realize that our destiny is inextricably linked to the success of Mikhail Gorbachev?...",The New York Times,"[u'UNITED STATES INTERNATIONAL RELATIONS', u'INTERNATIONAL RELATIONS', u'US-INTERNATIONAL RELATIONS-USSR']",http://www.nytimes.com/1989/07/31/opinion/essay-helping-gorby-succeed.html,7/31/89,Op-Ed,4fd1a6868eb7c8105d6c0c5dTV Making Obscure Brazilian The Candidate to Beat at 39,World; Front Page,[u'BRAZIL'],1453,LEAD: Poll takers are asking Brazilians whom they plan to vote for in the presidential elections....,The New York Times,"[u'TELEVISION', u'ECONOMIC CONDITIONS AND TRENDS', u'ELECTIONS']",http://www.nytimes.com/1989/07/31/world/tv-making-obscure-brazilian-the-candidate-to-beat-at-39.html,7/31/89,News,4fd184528eb7c8105d6831e2BUSINESS DIGEST,Business,[],632,LEAD:  International Report...,The New York Times,[u'NO INDEX TERMS'],http://www.nytimes.com/1989/07/31/business/business-digest-899889.html,7/31/89,Summary,4fd184538eb7c8105d6831e9BUSINESS DIGEST,Business,[],616,LEAD:  Markets...,The New York Times,[u'NO INDEX TERMS'],http://www.nytimes.com/1989/08/01/business/business-digest-158189.html,8/1/89,Summary,4fd18e4a8eb7c8105d693790"In a Day of Wild Swings, Dow Drops 19.54",Business,[],457,LEAD: The stock market staged one of its wildest performances in weeks yesterday....,The New York Times,"[u'STOCKS AND BONDS', u'DOW JONES STOCK AVERAGE', u'STOCK PRICES AND TRADING VOLUME']",http://www.nytimes.com/1989/08/02/business/in-a-day-of-wild-swings-dow-drops-19.54.html,8/2/89,News,4fd196338eb7c8105d6a2dd1Greenspan Says Fed Is Continuing to Ease Credit,Business,[u'UNITED STATES'],883,"LEAD: Signaling that interest rates are likely to fall further, the chairman of the Federal Reserve Board said today that the central bank is continuing to ease its credit policy to avoid a recession....",The New York Times,"[u'RECESSION AND DEPRESSION', u'UNITED STATES ECONOMY', u'CREDIT']",http://www.nytimes.com/1989/08/02/business/greenspan-says-fed-is-continuing-to-ease-credit.html,8/2/89,News,4fd1a67e8eb7c8105d6c0574"Dollar Makes Slight Gains, But Dealers See No Trend",Business,[],295,LEAD: The dollar advanced against most leading foreign currencies in subdued trading in New York yesterday....,AP,"[u'INTERNATIONAL MONETARY SYSTEM', u'PRICES', u'GOLD', u'CURRENCY']",http://www.nytimes.com/1989/08/03/business/currency-markets-dollar-makes-slight-gains-but-dealers-see-no-trend.html,8/3/89,News,4fd1a7e98eb7c8105d6c3222"Seeing a Dependent and Declining U.S., More Japanese Adopt a Nationalistic Spirit",World; Washington,[u'JAPAN'],1523,"LEAD: In a volume called ''The Japan That Can Say No,'' selling briskly in Tokyo bookstores these days, a dark-horse candidate to be the next Prime Minister argues forcefully that Japan no longer needs to act like the deferential stepchild of the ...",The New York Times,"[u'JAPAN-INTERNATIONAL RELATIONS-US', u'UNITED STATES INTERNATIONAL RELATIONS', u'INTERNATIONAL RELATIONS']",http://www.nytimes.com/1989/08/04/world/seeing-a-dependent-and-declining-us-more-japanese-adopt-a-nationalistic-spirit.html,8/4/89,News,4fd185d88eb7c8105d6852efBUSINESS DIGEST,Business,[],640,"LEAD:  ECONOMY  Congressional conferees hammered out a compromise agreement on financing the savings and loan bailout that is acceptable to the Administration. Under the agreement, $20 billion of the bailout will be put on the budget and the remai...",The New York Times,[u'NO INDEX TERMS'],http://www.nytimes.com/1989/08/04/business/business-digest-051189.html,8/4/89,Summary,4fd18d8f8eb7c8105d691e26Stock Prices Rise Slightly; Dow Up 4.17,Business,[],446,LEAD: Stock prices were modestly higher yesterday as investors stayed on the sidelines awaiting today's report on employment in July....,The New York Times,"[u'STOCKS AND BONDS', u'DOW JONES STOCK AVERAGE', u'STOCK PRICES AND TRADING VOLUME']",http://www.nytimes.com/1989/08/04/business/stock-prices-rise-slightly-dow-up-4.17.html,8/4/89,News,4fd196348eb7c8105d6a2e79RISE FOR WEEK IS 18.21,Business,[],499,"LEAD: Stock prices fell yesterday, depressed by losses in the bond market after a surprisingly strong July employment report allayed fears of recession and dampened hopes of further declines in interest rates....",The New York Times,"[u'INTEREST (MONEY)', u'STOCKS AND BONDS', u'DOW JONES STOCK AVERAGE', u'RATES', u'STOCK PRICES AND TRADING VOLUME']",http://www.nytimes.com/1989/08/05/business/dow-off-8.16-rise-for-week-is-18.21.html,8/5/89,News,4fd1a6848eb7c8105d6c0a5bIN THE LAND OF THE BLIND CAUDILLO,Magazine,[u'DOMINICAN REPUBLIC'],4013,"LEAD: IN THE MIDDLE OF A VILLAGE OF brightly painted wooden huts a helicopter touches down and a small, elderly, blind man, smartly dressed in a gray suit and gray fedora, is carefully helped out and guided into a long, black Lincoln. The limousin...",The New York Times,"[u'PRICES', u'BUILDING (CONSTRUCTION)', u'STANDARD OF LIVING', u'ECONOMIC CONDITIONS AND TRENDS']",http://www.nytimes.com/1989/08/06/magazine/the-dominican-republic-in-the-land-of-the-blind-caudillo.html,8/6/89,News,4fd185d98eb7c8105d6853d4"VOUCHER, VOUCHER, WHO GETS THE VOUCHER?",Arts; Books,[],1371,"LEAD: PRIVATIZATION AND EDUCATIONAL CHOICE  By Myron Lieberman.  386 pp. New York: St. Martin's Press.  Cloth, $35. Paper, $12.95....",The New York Times,[u'BOOK REVIEWS'],http://www.nytimes.com/1989/08/06/books/voucher-voucher-who-gets-the-voucher.html,8/6/89,Review,4fd1a6bb8eb7c8105d6c0e73Rates Expected to Decline Further,Business,[],755,"LEAD: Some credit market analysts and participants contend that the trend toward lower interest rates is not over, even though rates jumped sharply on Friday....",The New York Times,"[u'INTEREST (MONEY)', u'FORECASTS', u'CREDIT', u'STOCKS AND BONDS']",http://www.nytimes.com/1989/08/07/business/credit-markets-rates-expected-to-decline-further.html,8/7/89,News,4fd1a5a28eb7c8105d6bf14eDollar's Strength A Surprise,Business,[u'UNITED STATES'],1208,"LEAD: Although it has fallen from its highs in June, the dollar is still showing surprising strength in what has been one of the most volatile periods of foreign-exchange trading in recent years, traders and economists say....",The New York Times,"[u'INTERNATIONAL MONETARY SYSTEM', u'UNITED STATES ECONOMY', u'INTEREST (MONEY)', u'CURRENCY', u'FORECASTS', u'CREDIT']",http://www.nytimes.com/1989/08/07/business/dollar-s-strength-a-surprise.html,8/7/89,News,4fd1a7eb8eb7c8105d6c33f7Dow Up 1.6%; Record High for Transports,Business,[],708,"LEAD: Stock prices soared yesterday, and the Dow Jones industrial average surged 41.54 points, or 1.6 percent, to 2,694.99....",The New York Times,"[u'RECORDS AND ACHIEVEMENTS', u'STOCKS AND BONDS', u'DOW JONES STOCK AVERAGE', u'STOCK PRICES AND TRADING VOLUME']",http://www.nytimes.com/1989/08/08/business/dow-up-1.6-record-high-for-transports.html,8/8/89,News,4fd1a6bc8eb7c8105d6c0f9aLima Journal; Peru Rises Up Against Red Tape's 400-Year Rule,World,[u'PERU'],837,"LEAD: Clutching a thick pension file, Natividad Chirinos Contrega was happy to learn that she no longer needed a certificate proving to skeptical bureaucrats that she was alive....",The New York Times,"[u'REFORM AND REORGANIZATION', u'BUREAUCRATIC RED TAPE', u'POLITICS AND GOVERNMENT', u'IDENTIFICATION DEVICES', u'LAW AND LEGISLATION', u'ECONOMIC CONDITIONS AND TRENDS']",http://www.nytimes.com/1989/08/08/world/lima-journal-peru-rises-up-against-red-tape-s-400-year-rule.html,8/8/89,News,4fd1a7e78eb7c8105d6c305bProspect of Racial Parity Called Bleak,U.S.,[],618,"LEAD: Gaps between blacks and whites in employment, income, education and other social and economic areas are so broad that parity is unlikely until after the year 2000, the National Urban League said in a report made public today....",The New York Times,"[u'UNITED STATES ECONOMY', u'BLACKS (IN US)', u'ECONOMIC CONDITIONS AND TRENDS']",http://www.nytimes.com/1989/08/08/us/prospect-of-racial-parity-called-bleak.html,8/8/89,News,4fd185848eb7c8105d684d82