headline,section,locations,word_count,snippet,source,subjects,url,date,type,idBusiness Digest,Business,[],604,LEAD:  Companies...,The New York Times,[u'NO INDEX TERMS'],http://www.nytimes.com/1989/10/06/business/business-digest-280489.html,10/6/89,Summary,4fd189938eb7c8105d68aff0CHINA FEARS STRIFE DURING HARD TIMES,World,"[u""CHINA, PEOPLE'S REPUBLIC OF""]",1760,LEAD: China has entered a period of severe economic austerity and budget shortages that Government officials and foreign economists say may create new political dissatisfaction and uncertainties at a time when the Communist Party is trying to rall...,The New York Times,"[u'LABOR', u'WAGES AND SALARIES', u'FINANCES', u'POLITICS AND GOVERNMENT', u'BUDGETS AND BUDGETING', u'DEMONSTRATIONS AND RIOTS', u'ECONOMIC CONDITIONS AND TRENDS']",http://www.nytimes.com/1989/10/08/world/china-fears-strife-during-hard-times.html,10/8/89,News,4fd196bc8eb7c8105d6a415aLECH'S AMERICAN ANGEL,Magazine,"[u'GDANSK (POLAND)', u'POLAND']",4974,"LEAD: IT WAS A PERFECT PLACE FOR AN EPIPHANY. THE SCENE WAS near St. Brygida's Church in Gdansk, the spiritual home of Poland's Solidarity movement. The date was May 25, 1989, the occasion the annual Corpus Christi procession. Among those leading ...",The New York Times,[],http://www.nytimes.com/1989/10/08/magazine/lech-s-american-angel.html,10/8/89,News,4fd1aa3b8eb7c8105d6c7765Unfinished Business With Canada,Business,"[u'CANADA', u'UNITED STATES']",2155,"LEAD: Nine months after the United States-Canada free-trade agreement began chipping away at tariffs and trade barriers, trade relations between the world's two busiest trading partners have slipped once again to their accustomed place on the poli...",The New York Times,[u'INTERNATIONAL TRADE AND WORLD MARKET'],http://www.nytimes.com/1989/10/08/business/unfinished-business-with-canada.html,10/8/89,News,4fd1a7e58eb7c8105d6c2e5eBUSINESS DIGEST,Business,[],587,"LEAD:  INTERNATIONAL REPORT  The Bush Administration is under growing pressure from West Germany and other European allies, as well as American manufacturers, to allow the export of sophisticated machine tools to Communist countries. [ Page D1. ] ...",The New York Times,[u'NO INDEX TERMS'],http://www.nytimes.com/1989/10/09/business/business-digest-930589.html,10/9/89,Summary,4fd1aa418eb7c8105d6c7c77Albany Gets Private Offer To Purchase Its Airport,New York and Region,"[u'NEW YORK STATE', u'ALBANY COUNTY (NY)', u'ALBANY COUNTY AIRPORT (NY)']",1270,"LEAD: While virtually every American airport served by scheduled airliners is publicly owned, Albany County is considering an unusual offer by a private group to buy its 61-year-old airport....",The New York Times,[u'AIRPORTS'],http://www.nytimes.com/1989/10/09/nyregion/albany-gets-private-offer-to-purchase-its-airport.html,10/9/89,News,4fd188ec8eb7c8105d689949Cargo Boom Causes Plane Shortage,Business,[],1411,"LEAD: Sharp growth in cargo shipments by air is producing a shortage of freighter aircraft around the world. Companies with freight to ship are having trouble finding planes on short notice, and freight rates have begun to rise....",The New York Times,"[u'AIRLINES AND AIRPLANES', u'FREIGHT', u'SHORTAGES']",http://www.nytimes.com/1989/10/09/business/cargo-boom-causes-plane-shortage.html,10/9/89,News,4fd18e4b8eb7c8105d6937e3News Summary,New York and Region,[],898,"LEAD:  International A2-7, A18  East German protesters clashed with the police in cities throughout the nation. The Government celebration of its 40th anniversary of Communism has prompted rallies and demonstrations urging reform. Page A1  Emigres...",The New York Times,[u'NO INDEX TERMS'],http://www.nytimes.com/1989/10/09/nyregion/news-summary-937289.html,10/9/89,Summary,4fd18f318eb7c8105d695323Mexico's Baja Wines In Bid for U.S. Market,Business,"[u'UNITED STATES', u'BAJA CALIFORNIA', u'MEXICO']",1148,"LEAD: If the wines of California can become world-renowned and gain respect, then the wines of Baja California should be able to do the same. If Mexican beer can be made to appeal to the American palate, the same should be true of Mexican wine....",The New York Times,"[u'INTERNATIONAL TRADE AND WORLD MARKET', u'WINES']",http://www.nytimes.com/1989/10/09/business/international-report-mexico-s-baja-wines-in-bid-for-us-market.html,10/9/89,News,4fd18f318eb7c8105d69531eLittle Chance Seen for Bills That Would Put Rein on Fed,Business,[u'UNITED STATES'],1192,"LEAD: This month, Congress plans to take its first close look in years at how the Federal Reserve makes economic policy. Two competing measures introduced by House Democrats, one supported and the other strongly opposed by the Fed, would in totall...",The New York Times,[u'LAW AND LEGISLATION'],http://www.nytimes.com/1989/10/10/business/little-chance-seen-for-bills-that-would-put-rein-on-fed.html,10/10/89,News,4fd197998eb7c8105d6a60dbBusiness Digest,Business,[],625,LEAD:  Companies...,The New York Times,[u'NO INDEX TERMS'],http://www.nytimes.com/1989/10/10/business/business-digest-176889.html,10/10/89,Summary,4fd18f328eb7c8105d6953fdIndonesia Moving Quietly Toward a More Private Economy,World,"[u'INDONESIA, REPUBLIC OF']",1390,"LEAD: In the last few years, there has been a quiet but undisputed economic revolution in Indonesia, which is moving away from the traditional economy - planned, dominated and often owned by the state - toward more deregulation and private enterpr...",The New York Times,[u'ECONOMIC CONDITIONS AND TRENDS'],http://www.nytimes.com/1989/10/11/world/indonesia-moving-quietly-toward-a-more-private-economy.html,10/11/89,News,4fd18fe18eb7c8105d6964c9BUSINESS DIGEST,Business,[],664,"LEAD:  ECONOMY  Supporters of a lower capital gains tax are bidding for votes in the Senate, offering ever more generous packages of tax breaks. The latest offering would cut capital gains taxes for individual taxpayers and corporations. It would ...",The New York Times,[u'NO INDES TERMS'],http://www.nytimes.com/1989/10/11/business/business-digest-462689.html,10/11/89,Summary,4fd185d68eb7c8105d685192Dow Off 11.97 in Reaction to Weaker Bonds,Business,[],541,LEAD: Stocks ended lower yesterday as a weaker bond market and the selling of blue-chip issues pushed equities down for the second day....,The New York Times,"[u'STOCKS AND BONDS', u'DOW JONES STOCK AVERAGE', u'STOCK PRICES AND TRADING VOLUME']",http://www.nytimes.com/1989/10/12/business/dow-off-11.97-in-reaction-to-weaker-bonds.html,10/12/89,News,4fd188eb8eb7c8105d689920The New Soviet Mafia,Opinion,[u'UNION OF SOVIET SOCIALIST REPUBLICS (USSR)'],760,"LEAD: If you were a racketeer seeking huge monetary reward with little potential of getting caught, what racket would you choose and where would you go?...",The New York Times,"[u'POLITICS AND GOVERNMENT', u'ETHICS', u'BRIBERY', u'ECONOMIC CONDITIONS AND TRENDS']",http://www.nytimes.com/1989/10/12/opinion/essay-the-new-soviet-mafia.html,10/12/89,Op-Ed,4fd185de8eb7c8105d6857c5Japan Lifts Discount Rate; Dollar Still Gains,Business,[u'UNITED STATES'],910,"LEAD: The Bank of Japan surprised the foreign exchange market here today by abruptly raising its discount rate a half-percentage point in an effort to stem the dollar's surge. But the increase, announced at midday, had a negligible impact, prompti...",The New York Times,"[u'INTERNATIONAL MONETARY SYSTEM', u'DISCOUNT RATE', u'CURRENCY', u'CREDIT']",http://www.nytimes.com/1989/10/12/business/japan-lifts-discount-rate-dollar-still-gains.html,10/12/89,News,4fd185de8eb7c8105d6857c3BUSINESS DIGEST,Business,[],723,LEAD: THE ECONOMY  Senate Democratic leaders said they had enough votes to keep a capital gains tax cut out of the deficit-reduction package under consideration. Republicans conceded that they could not muster the 60 votes needed to add the tax cu...,The New York Times,[u'NO INDEX TERMS'],http://www.nytimes.com/1989/10/13/business/business-digest-063489.html,10/13/89,Summary,4fd1aa468eb7c8105d6c803c"BUSINESS DIGEST: SATURDAY, OCTOBER, 14, 1989",Business,[],626,LEAD:  Market Turmoil...,The New York Times,[u'NO INDEX TERMS'],http://www.nytimes.com/1989/10/14/business/business-digest-saturday-october-14-1989.html,10/14/89,Summary,4fd185dd8eb7c8105d685723"Wall Street Executives Stress Differences, But Traders Point to Troubling Similarities",Business,[],966,"LEAD: The parallels were almost eerie: a Friday afternoon in October, the 13th no less, and the stock market suddenly goes into a free fall. In less than an hour, the Dow Jones index had declined by nearly 200 points....",The New York Times,"[u'STOCKS AND BONDS', u'DOW JONES STOCK AVERAGE', u'STOCK PRICES AND TRADING VOLUME']",http://www.nytimes.com/1989/10/14/business/it-1987-again-wall-street-executives-stress-differences-but-traders-point.html,10/14/89,An Analysis; News Analysis,4fd188eb8eb7c8105d6898bfTAKEOVER STOCKS HIT HARD,Business,[],1688,"LEAD: A late wave of selling swept the stock market yesterday, sending the Dow Jones industrial average down 190.58 points, or 6.9 percent, to 2,569.26. In terms of points, the decline was the second largest in history, exceeded only by the 508-po...",The New York Times,"[u'STOCKS AND BONDS', u'DOW JONES STOCK AVERAGE', u'STOCK PRICES AND TRADING VOLUME']",http://www.nytimes.com/1989/10/14/business/the-dow-plunges-190-points-about-7-in-late-selloff-takeover-stocks-hit-hard.html,10/14/89,News,4fd188eb8eb7c8105d6898bdYugoslav Premier Seeks U.S. Aid,World; Washington,[u'YUGOSLAVIA'],250,"LEAD: Prime Minister Ante Markovic of Yugoslavia met with President Bush today, seeking United States assistance in making economic and political changes opposed by hard-liners in the Communist Party....",The New York Times,"[u'UNITED STATES INTERNATIONAL RELATIONS', u'ECONOMIC CONDITIONS AND TRENDS', u'FOREIGN AID']",http://www.nytimes.com/1989/10/14/world/yugoslav-premier-seeks-us-aid.html,10/14/89,News,4fd18e4a8eb7c8105d693778Wall St. Cites Sound Fundamentals,Business,[],787,"LEAD: Although Wall Street was stunned by the selling wave that swept the stock market in the last hour of trading yesterday, it was not devastated. Some market participants attributed the 190-point, or 6.9 percent, plunge in the Dow Jones industr...",The New York Times,"[u'STOCKS AND BONDS', u'STOCK PRICES AND TRADING VOLUME']",http://www.nytimes.com/1989/10/14/business/wall-st-cites-sound-fundamentals.html,10/14/89,News,4fd1a96f8eb7c8105d6c6059FEDERAL RESERVE MOVES TO PROVIDE CASH TO MARKETS,U.S.,"[u'EUROPE, WEST', u'ASIA', u'UNITED STATES']",1173,"LEAD: Seeking to maintain calm in the nation's financial system, the Federal Reserve Board intends to meet any sudden demands for money that might result from the stock market's sharp plunge Friday, a top official of the nation's central bank said...",The New York Times,"[u'STOCKS AND BONDS', u'STOCK PRICES AND TRADING VOLUME']",http://www.nytimes.com/1989/10/15/us/federal-reserve-moves-to-provide-cash-to-markets.html,10/15/89,News,4fd18e4f8eb7c8105d693b6fOctober Turns Ugly Once More,Business,[],859,"LEAD: Stocks had a dizzying plunge on Friday, with the Dow Jones industrial average dropping a scary 190.58 points and reviving painful memories of the 1987 stock crash that produced a 508-point plunge on Oct. 19. Friday's heavy selling wiped out ...",The New York Times,[u'NO INDEX TERMS'],http://www.nytimes.com/1989/10/15/business/week-in-business-october-turns-ugly-once-more.html,10/15/89,Summary,4fd18f348eb7c8105d69561eThat Last Step When the Tango Turns Deadly,Arts; Theater,[],1591,"LEAD: In a room that smells of smoke and sweat, a man dressed in a brown shirt, black pants and leather boots drags a woman along the floor by her hair. In another part of the room, a man in a black hat pulled low over his eyes thrusts his knee be...",The New York Times,[u'THEATER'],http://www.nytimes.com/1989/10/15/theater/theater-that-last-step-when-the-tango-turns-deadly.html,10/15/89,News,4fd18e4f8eb7c8105d693b6a"Eat and Be Wary, Governor",U.S.,[u'DALLAS (TEX)'],245,"LEAD: Gov. Bill Clements was among several diners who witnessed an armed robbery at a restaurant Thursday night in which one man was shot. The lone robber apparently did not recognize Mr. Clements, who was seatedestors sell their shares, because h...",Reuters,[u'ROBBERIES AND THEFTS'],http://www.nytimes.com/1989/10/15/us/eat-and-be-wary-governor.html,10/15/89,News,52b85b1838f0d8094087c715The Roots Of a Selloff,Business,[],1270,"LEAD: The October slide in stock prices began in Japan and Europe, touched off by rising interest rates, and then spread to the United States with a sharp, startling one-day drop that provoked memories of 1987....",The New York Times,"[u'STOCKS AND BONDS', u'STOCK PRICES AND TRADING VOLUME']",http://www.nytimes.com/1989/10/16/business/the-roots-of-a-selloff.html,10/16/89,An Analysis; News Analysis,4fd1aa408eb7c8105d6c7b4bRights and Wrongs of Blaming Japan,Opinion,"[u'JAPAN', u'UNITED STATES']",1259,"LEAD: Frustration with Japan in the United States and resentment of America in Japan are near the flash point. Many Americans are upset about recent shifts in the global balance of economic power, shifts that seem to threaten American jobs and int...",The New York Times,"[u'FOREIGN INVESTMENTS', u'INTERNATIONAL TRADE AND WORLD MARKET', u'UNITED STATES ECONOMY', u'BALANCE OF PAYMENTS AND TRADE', u'EDITORIALS', u'PROTECTIONISM (TRADE)', u'FOREIGN INVESTMENTS IN US']",http://www.nytimes.com/1989/10/16/opinion/rights-and-wrongs-of-blaming-japan.html,10/16/89,Editorial,4fd18f2f8eb7c8105d6951feSilver Lining for Business Chiefs,Business,[],520,LEAD: Almost 150 past and present chief executives of American businesses gather here twice a year for a meeting of the Business Council and rarely do they have an event like Friday's stock market plunge to talk about....,The New York Times,"[u'STOCKS AND BONDS', u'STOCK PRICES AND TRADING VOLUME']",http://www.nytimes.com/1989/10/16/business/silver-lining-for-business-chiefs.html,10/16/89,News,4fd18f2f8eb7c8105d695209Fresh Look Is Taken at the State of the Economy,Business,[],871,"LEAD: The decline in the stock market Friday, the rebound today and the nervousness about what it all might mean led politicians, economists and business executives today to reappraise the state of the American economy and the Government's economi...",The New York Times,"[u'UNITED STATES ECONOMY', u'STOCKS AND BONDS', u'STOCK PRICES AND TRADING VOLUME']",http://www.nytimes.com/1989/10/17/business/a-volatile-market-fresh-look-is-taken-at-the-state-of-the-economy.html,10/17/89,News,4fd18e4e8eb7c8105d693addNews Summary,New York and Region,[],852,"LEAD:  International A3-15  The U.S. is ready to help Moscow with advice and technical aid to restructure the Soviet economy and society, Secretary Baker said. Page A1  Excerpts from Baker's speech A14  President Gorbachev rebuked some of the lead...",The New York Times,[u'NO INDEX TERMS'],http://www.nytimes.com/1989/10/17/nyregion/news-summary-016989.html,10/17/89,Summary,4fd1aa458eb7c8105d6c7f66"Much Fuss, Over What?; For Those Confused, A Few Explanations",Front Page; Business,[],1316,LEAD: Has a stock market that falls 190 points one day and rises 88 the next chance it gets simply lost its head?...,The New York Times,"[u'STOCKS AND BONDS', u'STOCK PRICES AND TRADING VOLUME']",http://www.nytimes.com/1989/10/17/business/much-fuss-over-what-for-those-confused-a-few-explanations.html,10/17/89,An Analysis; News Analysis,4fd185e28eb7c8105d685b1aTrade Deficit Widened by Import Surge,Business,[u'UNITED STATES'],998,"LEAD: The nation's trade deficit grew sharply in August, to $10.8 billion, as imports surged to a record and exports showed a small decline, the Commerce Department reported today....",The New York Times,[u'INTERNATIONAL TRADE AND WORLD MARKET'],http://www.nytimes.com/1989/10/18/business/trade-deficit-widened-by-import-surge.html,10/18/89,News,4fd1898a8eb7c8105d68a99fU.S. Economists Are Ready to Advise the Soviets,World,[u'UNION OF SOVIET SOCIALIST REPUBLICS (USSR)'],1128,"LEAD: American officials said today that they were prepared to advise the Soviet Union on how to revive its stagnant economy by decontrolling prices, cutting Government subsidies, encouraging private enterprise and permitting the exchange of ruble...",The New York Times,"[u'GOVERNMENTAL AID (NON-US)', u'CURRENCY', u'WAGE AND PRICE CONTROLS', u'ECONOMIC CONDITIONS AND TRENDS', u'US-INTERNATIONAL RELATIONS-USSR']",http://www.nytimes.com/1989/10/18/world/us-economists-are-ready-to-advise-the-soviets.html,10/18/89,News,4fd18f2f8eb7c8105d695187"Miroslaw Dzielski, 47, Polish Political Leader",Obituaries,[],226,"LEAD: Miroslaw Dzielski, a Polish political leader who espoused entrepreneurship and market-economy principles in his native country, died of bladder cancer on Sunday at the hospital of the National Institutes of Health in Bethesda, Md. He was 47 ...",The New York Times,[u'DEATHS'],http://www.nytimes.com/1989/10/18/obituaries/miroslaw-dzielski-47-polish-political-leader.html,10/18/89,Obituary,4fd1aa3f8eb7c8105d6c7adcSeoul Leader Offers Assurances To Congress Over Import Markets,World; Washington,"[u'SOUTH KOREA', u'UNITED STATES']",433,LEAD: President Roh Tae Woo of South Korea sought to assure Congress today that his nation would open its developing markets to foreign imports quickly and that anti-Americanism in his country was limited to a handful of radicals....,The New York Times,"[u'UNITED STATES INTERNATIONAL RELATIONS', u'INTERNATIONAL TRADE AND WORLD MARKET', u'PUBLIC OPINION', u'UNITED STATES ARMAMENT AND DEFENSE']",http://www.nytimes.com/1989/10/19/world/seoul-leader-offers-assurances-to-congress-over-import-markets.html,10/19/89,News,4fd185db8eb7c8105d68550eBUSINESS DIGEST,Business,[],690,"LEAD:  THE MARKETS  Investment bankers postponed two ''junk bond'' offerings totaling more than $1.2 billion because of volatile conditions in the high-risk, high-yield market. And Kohlberg & Company said Drexel Burnham Lambert, which was ''highly...",The New York Times,[u'NO INDEX TERMS'],http://www.nytimes.com/1989/10/19/business/business-digest-647389.html,10/19/89,Summary,4fd18e488eb7c8105d693562NEWS SUMMARY,New York and Region,[],860,"LEAD:  INTERNATIONAL A3-13  A new aid plan for Poland, which aims to support democracy and the development of a free-market economy, was passed by the House. A similar but smaller plan for Hungary was also passed. Page A1...",The New York Times,[u'NO INDEX TERMS'],http://www.nytimes.com/1989/10/20/nyregion/news-summary-985289.html,10/20/89,Summary,4fd18e508eb7c8105d693c4fA BROAD PROGRAM OF AID TO POLAND IS VOTED BY HOUSE,World; Front Page; Washington,"[u'HUNGARY', u'UNITED STATES', u'POLAND']",986,"LEAD: The House of Representatives voted overwhelmingly today to set up a major new program to support democracy, private enterprise and the development of a free-market economy in Poland....",The New York Times,"[u'UNITED STATES INTERNATIONAL RELATIONS', u'POLAND-INTERNATIONAL RELATIONS-US', u'HUNGARY-INTERNATIONAL RELATIONS-US', u'LAW AND LEGISLATION', u'ECONOMIC CONDITIONS AND TRENDS', u'FOREIGN AID']",http://www.nytimes.com/1989/10/20/world/a-broad-program-of-aid-to-poland-is-voted-by-house.html,10/20/89,News,4fd18e508eb7c8105d693c4cA.T.&T.'s Income Rises 19%; 'Baby Bell' Profits Are Mixed,Business,[],978,"LEAD: Reflecting the continued strong growth in long-distance calling, the American Telephone and Telegraph Company yesterday reported a 19 percent increase in its third-quarter earnings....",The New York Times,[u'COMPANY REPORTS'],http://www.nytimes.com/1989/10/20/business/at-t-s-income-rises-19-baby-bell-profits-are-mixed.html,10/20/89,News,4fd18f358eb7c8105d6956c9BUSINESS DIGEST,Business,[],617,LEAD:  International...,The New York Times,[u'NO INDEX TERMS'],http://www.nytimes.com/1989/10/20/business/business-digest-984389.html,10/20/89,Summary,4fd196c58eb7c8105d6a48b9"BUSINESS DIGEST: SATURDAY, OCTOBER 21, 1989",Business,[],683,LEAD:  Markets...,The New York Times,[u'NO INDEX TERMS'],http://www.nytimes.com/1989/10/21/business/business-digest-saturday-october-21-1989.html,10/21/89,Summary,4fd196c08eb7c8105d6a4485Changing the Color of Money Won't Stop Corruption,Opinion,[u'UNITED STATES'],625,LEAD: To the Editor:...,The New York Times,"[u'DRUG TRAFFIC', u'CURRENCY']",http://www.nytimes.com/1989/10/21/opinion/l-changing-the-color-of-money-won-t-stop-corruption-078589.html,10/21/89,Letter,4fd196c08eb7c8105d6a4483A Potential New Soviet Export Product: Cold-War-Surplus Missiles,World,"[u'EUROPE', u'UNION OF SOVIET SOCIALIST REPUBLICS (USSR)']",1309,"LEAD: In an effort to turn swords into plowshares, or ''tanks into tractors,'' as Secretary of State James A. Baker 3d put it last week, the Soviet Union is trying to turn its SS-20 missile into a commercial rocket for launching small satellites i...",The New York Times,"[u'ASTRONAUTICS', u'ARMS CONTROL AND LIMITATION AND DISARMAMENT', u'MISSILES']",http://www.nytimes.com/1989/10/22/world/a-potential-new-soviet-export-product-cold-war-surplus-missiles.html,10/22/89,News,4fd18f2c8eb7c8105d694ec3The Realities of 'Friday the 13th',Business,[u'JAPAN'],1842,"LEAD: Thank you, Tokyo....",The New York Times,"[u'STOCKS AND BONDS', u'STOCK PRICES AND TRADING VOLUME']",http://www.nytimes.com/1989/10/22/business/the-realities-of-friday-the-13th.html,10/22/89,News,4fd18e458eb7c8105d6932abWhy the Deficit Is Paralyzing Congress,Washington; Week in Review,[u'UNITED STATES'],1012,LEAD: RARELY in peacetime has a single issue dominated politics here the way the budget deficit is doing now....,The New York Times,"[u'UNITED STATES POLITICS AND GOVERNMENT', u'UNITED STATES ECONOMY', u'FINANCES', u'BUDGETS AND BUDGETING']",http://www.nytimes.com/1989/10/22/weekinreview/the-nation-why-the-deficit-is-paralyzing-congress.html,10/22/89,News,4fd185d78eb7c8105d6851dfProspects; Free Trade With Mexico,Health; Business,"[u'CANADA', u'UNITED STATES', u'MEXICO']",705,"LEAD: In comments made before a Senate hearing on the Latin American debt situation, Commerce Secretary Robert A. Mosbacher predicted that the United States and Mexico would eventually enter into a free-trade agreement similar to the one that went...",The New York Times,[u'INTERNATIONAL TRADE AND WORLD MARKET'],http://www.nytimes.com/1989/10/22/business/prospects-free-trade-with-mexico.html,10/22/89,News,4fd18f2c8eb7c8105d694ed5Hectic Recovery For Stock Prices,Business,[],928,LEAD: Stocks came back after the Friday the 13th plunge of 190 points. Sell orders poured in when the markets opened on Monday and the Dow Jones industrial average had an early 60- point loss but the market turned around within about an hour and t...,The New York Times,[u'NO INDEX TERMS'],http://www.nytimes.com/1989/10/22/business/week-in-business-hectic-recovery-for-stock-prices.html,10/22/89,Summary,4fd196bb8eb7c8105d6a40d2A Skyscraper-High Office Space Surplus,Real Estate,[u'NEW YORK CITY'],2461,"LEAD: WITH office construction running at high levels at a time when New York City and its suburbs are struggling through an economic downturn, experts say the region is confronting the largest office space surplus in more than a decade....",The New York Times,"[u'ECONOMIC CONDITIONS AND TRENDS', u'OFFICE BUILDINGS']",http://www.nytimes.com/1989/10/22/realestate/a-skyscraper-high-office-space-surplus.html,10/22/89,News,4fd18f2c8eb7c8105d694ebeEl Salvador Striving To Regain Prosperity,Business,[u'EL SALVADOR'],927,"LEAD: As El Salvador's civil war enters its second decade, the country's new conservative Government has initiated an audacious liberalization program intended to rebuild a battered economy and alleviate the social injustice, unemployment and stag...",The New York Times,"[u'UNEMPLOYMENT AND JOB MARKET', u'POLITICS AND GOVERNMENT', u'ECONOMIC CONDITIONS AND TRENDS']",http://www.nytimes.com/1989/10/23/business/international-report-el-salvador-striving-to-regain-prosperity.html,10/23/89,News,4fd18e4a8eb7c8105d693799Chile Plans to Create Strong Central Bank,Business,[u'CHILE'],814,"LEAD: As it prepares to turn over power to elected civilians, the Government of Gen. Augusto Pinochet is creating an autonomous central bank that it says will help preserve Chile's hard-won economic stability, growth and modernization....",The New York Times,"[u'POLITICS AND GOVERNMENT', u'ECONOMIC CONDITIONS AND TRENDS']",http://www.nytimes.com/1989/10/23/business/international-report-chile-plans-to-create-strong-central-bank.html,10/23/89,News,4fd197988eb7c8105d6a5fd3BUSINESS DIGEST,Business,[],641,"LEAD:  INTERNATIONAL  Military contractors are turning abroad for parts to build weapons systems, as the Pentagon puts pressure on companies to reduce costs and as foreign suppliers become more adept. The trend is raising fears on dependence, jobs...",The New York Times,[u'NO INDEX TERMS'],http://www.nytimes.com/1989/10/23/business/business-digest-656289.html,10/23/89,Summary,4fd197988eb7c8105d6a5fd6BUSINESS DIGEST,Business,[],622,LEAD:  The Economy...,The New York Times,[u'NO INDEX TERMS'],http://www.nytimes.com/1989/10/24/business/business-digest-907789.html,10/24/89,Summary,4fd18f2d8eb7c8105d694fedStocks Drop Broadly; Dow Off 26.23 Points,Business,[],700,"LEAD: Stocks dropped broadly yesterday, as investors focused on a faltering economy, weakening corporate profits and a stagnant dollar. The Dow Jones industrial average fell 26.23 points, or about 1 percent, to 2,662.91....",The New York Times,"[u'STOCKS AND BONDS', u'DOW JONES STOCK AVERAGE', u'STOCK PRICES AND TRADING VOLUME']",http://www.nytimes.com/1989/10/24/business/stocks-drop-broadly-dow-off-26.23-points.html,10/24/89,News,4fd185d88eb7c8105d685314