headline,section,locations,word_count,snippet,source,subjects,url,date,type,id
A BEWILDERING FALL FOR THE RETAILERS,Business,[],2154,"FOR years, retailers have enjoyed their self-image as the vital c onduit between the factory and the consumer, the link that has helped transform the United States into the world's greatest consumer economy. And for years, millions of Americans we...",The New York Times,"[u'SALES', u'UNITED STATES ECONOMY', u'CONTRACTS', u'CONSUMER BEHAVIOR', u'RETAIL STORES AND TRADE']",http://www.nytimes.com/1982/10/10/business/a-bewildering-fall-for-the-retailers.html,10/10/82,News,4fd1283e8eb7c8105d5eedd5
RENEWING AMERICAN CAPITALISM,Magazine; Opinion,[],137,"Robert Heilbroner's article is concerned, of course, with the ''high-stream'' economy, and it therefore ignores the gentle persistence, at lower levels, of historically earlier ways of doing business, e.g., small business in a big-business economy...",The New York Times,[u'UNITED STATES ECONOMY'],http://www.nytimes.com/1982/10/10/magazine/l-renewing-american-capitalism-204403.html,10/10/82,Letter,4fd12b7a8eb7c8105d5f4898
First article of a series appearing periodically on the effects of changing economic conditions on some American families.,U.S.,[u'UNITED STATES'],2043,"By almost any standard used to identify the upwardly mobile middle class, Walter and Dianna Sue Bryant once qualified.   Mr. Bryant, a 40-year-old printer, still speaks with pride of working most of his adult life. In recent years Mrs. Bryant has ...",The New York Times,"[u'UNEMPLOYMENT AND JOB MARKET', u'UNITED STATES ECONOMY', u'FAMILIES AND FAMILY LIFE']",http://www.nytimes.com/1982/10/10/us/job-losses-end-prosperity-for-more-families-first-article-series-appearing.html,10/10/82,Series,4fd129048eb7c8105d5f00bd
Advertising; Agencies Also Have Lean Year,Business,[],373,"THE economy has been rougher on the ad agencies so far this year than their managers estimated going in, and now they think the fourth quarter is going to be worse.   That information comes from a meeting of the board of the American Association o...",The New York Times,"[u'ADVERTISING', u'FINANCES', u'INDUSTRY PROFILES']",http://www.nytimes.com/1982/10/11/business/advertising-agencies-also-have-lean-year.html,10/11/82,News,4fd127e18eb7c8105d5ee54d
A SHORTAGE OF OIL SEEN AFTER 1985,Business,[u'UNION OF SOVIET SOCIALIST REPUBLICS'],667,"An oil shortage and price run-up is likely to undermine any Western economic recovery after 1985 unless countries do more to reduce dependence on imported oil, the International Energy Agency warned today.   The agency, which coordinates Western e...",The New York Times,"[u'GAS (FUEL)', u'CONSERVATION OF RESOURCES', u'INTERNATIONAL TRADE AND WORLD MARKET', u'PRICES', u'UNITED STATES INTERNATIONAL TRADE', u'SHORTAGES', u'OIL (PETROLEUM) AND GASOLINE', u'COAL']",http://www.nytimes.com/1982/10/12/business/a-shortage-of-oil-seen-after-1985.html,10/12/82,News,4fd1290e8eb7c8105d5f0611
"TUESDAY, OCTOBER 12, 1982; Markets",Business,[],690,"The stock market, caught up in a historic rally, surged onward despite the Columbus Day holiday. The Dow Jones industrial average climbed above 1,000 for the first time since April 28, 1981, rising 25.94 points, to 1,012.79. It has gained 110.96 p...",The New York Times,[u'NO INDEX TERMS'],http://www.nytimes.com/1982/10/12/business/business-digest-tuesday-october-12-1982-markets.html,10/12/82,Summary,4fd1290e8eb7c8105d5f0613
"DOW IS OVER 1,000 FIRST TIME IN YEAR",Front Page; Business,[],1054,"In the fourth day of an exuberant stock market rally, the Dow Jones industrial average rose 25.94 points yesterday and closed above 1,000 for the first time since mid-1981.   The rise in the average reflected the growing conviction that interest r...",The New York Times,"[u'STOCKS AND BONDS', u'DOW JONES STOCK AVERAGE', u'STOCK PRICES AND TRADING VOLUME']",http://www.nytimes.com/1982/10/12/business/stocks-soar-again-dow-is-over-1000-first-time-in-year.html,10/12/82,News,4fd1244d8eb7c8105d5e94b4
TRADE DISPUTES MAR CANADA-U.S. TIES,Business,[u'CANADA'],716,"Although both sides have made efforts in the past year to soften the rhetoric, the United States and Canada remain at odds on a number of trade and investment issues.   The two nations, which share the closest trade relationship in the world, have...",The New York Times,"[u'TRUCKS AND TRUCKING INDUSTRY', u'UNITED STATES INTERNATIONAL TRADE', u'UNITED STATE INTERNATIONAL RELATIONS', u'REGULATION AND DEREGULATION OF INDUSTRY']",http://www.nytimes.com/1982/10/12/business/trade-disputes-mar-canada-us-ties.html,10/12/82,News,4fd1244d8eb7c8105d5e94b5
INVESTMENTS THAT HURT THE U.S. ECONOMY,Opinion,[],210,"To the Editor:     As an associate of Reubin Askew in the Carter Administration, I agree with a number of his prescriptions for a revised trade policy, but I strongly demur from his advice to promote American investment overseas (Op-Ed Oct. 3). Su...",The New York Times,"[u'FOREIGN INVESTMENTS', u'LABOR', u'UNITED STATES INTERNATIONAL TRADE', u'UNITED STATE INTERNATIONAL RELATIONS']",http://www.nytimes.com/1982/10/13/opinion/l-investments-that-hurt-the-us-economy-215908.html,10/13/82,Letter,4fd1248f8eb7c8105d5e9a58
ARMY RECRUITING THRIVES AS ECONOMY FALTERS,World; Front Page,"[u'YOUNGSTOWN (OHIO)', u'UNITED STATES']",1344,"On the new downtown brick mall, between two empty shops and across the street from a shuttered department store, is one of Youngstown's most successful enterprises, the Armed Forces Recruiting Station.   ''We've gone double in terms of quality,'' ...",The New York Times,"[u'LABOR', u'UNEMPLOYMENT AND JOB MARKET', u'DRAFT AND RECRUITMENT, MILITARY', u'ECONOMIC CONDITIONS AND TRENDS', u'MILITARY PERSONNEL', u'UNITED STATES ARMAMENT AND DEFENSE']",http://www.nytimes.com/1982/10/13/world/army-recruiting-thrives-as-economy-falters.html,10/13/82,News,4fd12b7c8eb7c8105d5f4946
News Analysis,World; Front Page,[u'UNITED STATES'],944,"With his election season address on the economy tonight, President Reagan went further than he has in the past in acknowledging that unemployment - not inflation - had become the No.1 problem facing his Administration and the No.1 worry afflicting...",The New York Times,"[u'UNEMPLOYMENT AND JOB MARKET', u'UNITED STATES ECONOMY', u'PRICES']",http://www.nytimes.com/1982/10/14/world/focus-on-unemployment-news-analysis.html,10/14/82,An Analysis,4fd128498eb7c8105d5ef381
"News Summary; THURSDAY, OCTOBER 14, 1982",New York and Region,[],816,International Polish shipyard workers who struck for two days in Gdansk over the outlawing of the independent trade union Solidarity returned to work after the martial-law authorities drafted them into military service. But new protests erupted in...,The New York Times,[u'NO INDEX TERMS'],http://www.nytimes.com/1982/10/14/nyregion/news-summary-thursday-october-14-1982.html,10/14/82,Summary,4fd1244e8eb7c8105d5e95ca
POLICY AND THE ECONOMY,U.S.,[u'UNITED STATES'],3634,"Following is a transcript of the address by the President to the nation from Washington last night, as recorded by The New York Times: My fellow Americans, in recent days all of us have been swamped by a sea of economic statistics, some good, some...",The New York Times,"[u'UNEMPLOYMENT AND JOB MARKET', u'UNITED STATES ECONOMY', u'PRICES', u'INTEREST (MONEY)', u'CREDIT', u'BUDGETS AND BUDGETING', u'GOVERNMENT SPENDING']",http://www.nytimes.com/1982/10/14/us/transcript-of-reagan-s-speech-to-nation-on-gop-policy-and-the-economy.html,10/14/82,Text,4fd128498eb7c8105d5ef37f
PRESIDENT ASSERTS ECONOMIC POLICIES PROVE EFFECTIVE,Front Page; U.S.,[u'UNITED STATES'],1508,President Reagan said tonight that even though unemployment remained high his economic policies were effectively attacking its root causes. He said the nation could slowly work its way back to prosperity if it had ''the courage to see it through.'...,The New York Times,"[u'UNEMPLOYMENT AND JOB MARKET', u'UNITED STATES ECONOMY', u'PRICES']",http://www.nytimes.com/1982/10/14/us/president-asserts-economic-policies-prove-effective.html,10/14/82,News,4fd13af98eb7c8105d610663
FAMILIES FACING RECESSION'S STRESSES,Home and Garden; Style,[u'UNITED STATES'],1015,"DURHAM, N.H.  ''THE stress on American families now is of a different order than ever before,'' said Dr. M. Harvey Brenner, an economist and medical sociologist at Johns Hopkins University. ''Their psychic pain is worse than that of families in th...",The New York Times,"[u'RECESSION AND DEPRESSION', u'LABOR', u'UNEMPLOYMENT AND JOB MARKET', u'CONVENTIONS AND CONFERENCES', u'FAMILIES AND FAMILY LIFE']",http://www.nytimes.com/1982/10/14/garden/families-facing-recession-s-stresses.html,10/14/82,News,4fd12a928eb7c8105d5f31a0
BIG 3 AUTO SALES UP 1.7% IN 10 DAYS,Business,[],553,"The Big Three auto makers reported today that their sales rose 1.7 percent in the first 10 days of October, the start of the 1983 model year.   ''I expect to see continued moderate gains in the fourth quarter, as interest rates continue to decline...",The New York Times,"[u'SALES', u'AUTOMOBILES', u'UNITED STATES ECONOMY', u'CONTRACTS']",http://www.nytimes.com/1982/10/14/business/big-3-auto-sales-up-1.7-in-10-days.html,10/14/82,News,4fd12b838eb7c8105d5f4e84
LOCAL VOTE IN GREECE A TEST FOR SOCIALISTS,World,[u'GREECE'],585,"When Greeks vote next Sunday, they will be looking for solutions to urgent problems of pollution, garbage, traffic congestion, poor social services - for an improvement in the quality of life.   But foremost on their minds will be the performance ...",The New York Times,"[u'SOCIAL CONDITIONS AND TRENDS', u'POLITICS AND GOVERNMENT', u'ELECTIONS']",http://www.nytimes.com/1982/10/15/world/local-vote-in-greece-a-test-for-socialists.html,10/15/82,News,4fd12b7d8eb7c8105d5f49e2
News Analysis,Front Page; U.S.; Washington,[u'UNITED STATES'],1175,"Republicans appear to be receiving more blame than credit from the electorate for the performance of the economy. They seem to be losing more support because of rising unemployment than they are gaining from lessened inflation, lower interest rate...",The New York Times,"[u'UNEMPLOYMENT AND JOB MARKET', u'UNITED STATES POLITICS AND GOVERNMENT', u'PUBLIC OPINION', u'UNITED STATES ECONOMY', u'PRICES']",http://www.nytimes.com/1982/10/15/us/jobs-vs-prices-a-difficult-voter-assessment-news-analysis.html,10/15/82,An Analysis,4fd129078eb7c8105d5f0228
HARD TIMES FOR CATERPILLAR,Business,[],1107,It was never supposed to happen in this prosperous company town. The Caterpillar Tractor Company - known for good management and efficient plants - had been one of the success stories among American heavy manufacturers.   But the company's good fo...,The New York Times,"[u'COMPANY AND ORGANIZATION PROFILES', u'FINANCES', u'STOCKS AND BONDS', u'COMPANY REPORTS']",http://www.nytimes.com/1982/10/15/business/hard-times-for-caterpillar.html,10/15/82,News,4fd129078eb7c8105d5f0226
"FRIDAY, OCTOBER 15, 1982; Markets",Business,[],663,"Stock prices, swept by heavy profit taking, fell precipitously. The Dow Jones industrial average, after soaring 108 points in the previous six sessions, dropped below 1,000, declining 18.21 points, to 996.87. But declining stocks on the Big Board ...",The New York Times,[u'NO INDEX TERMS'],http://www.nytimes.com/1982/10/15/business/business-digest-friday-october-15-1982-markets.html,10/15/82,Summary,4fd129078eb7c8105d5f0232
G.O.P. FEARS IMPACT IN TIGHT RACES,U.S.; Washington,[],1045,"Marilyn Stratmeyer is part of a profound change in American politics.  For the first 10 years of her marriage, she stayed home in Lennox, S.D., reared her three children, and took her husband's advice about politics. Now she is working as a waitre...",The New York Times,"[u'UNITED STATES POLITICS AND GOVERNMENT', u'PUBLIC OPINION', u'WOMEN']",http://www.nytimes.com/1982/10/15/us/working-women-critical-of-reagan-gop-fears-impact-in-tight-races.html,10/15/82,News,4fd13af38eb7c8105d610308
PRESIDENT OFFERS BIG GRAIN DEAL TO SOVIET UNION,Business,[u'UNION OF SOVIET SOCIALIST REPUBLICS'],912,"President Reagan announced today that the United States had offered to sell 23 million tons of grain this year to the Soviet Union, a quantity nearly three times greater than the amount provided for under an existing sales agreement between the tw...",The New York Times,"[u'UNITED STATES INTERNATIONAL TRADE', u'UNITED STATE INTERNATIONAL RELATIONS', u'BOYCOTTS', u'GRAIN']",http://www.nytimes.com/1982/10/16/business/president-offers-big-grain-deal-to-soviet-union.html,10/16/82,News,4fd12a938eb7c8105d5f3287
WALLACE CAST IN UNFAMILIAR ROLE AS THE LIBERAL IN ALABAMA GOVERNOR RACE,U.S.,[u'ALABAMA'],2040,"It was virtually a quarter-century ago that a tiny, combative rural judge strutted in from nowhere to command Alabama's public stage, play on the fretting discontent of a nation and place his stamp on the political mind of America.   Now, George C...",The New York Times,"[u'GOVERNORS (US)', u'POLITICS AND GOVERNMENT', u'ELECTIONS']",http://www.nytimes.com/1982/10/16/us/wallace-cast-in-unfamiliar-role-as-the-liberal-in-alabama-governor-race.html,10/16/82,Series,4fd1284a8eb7c8105d5ef442
"SATURDAY, OCTOBER 16, 1982; The Economy",Business,[],683,"The index of producer prices fell 0.1 percent in September, indicating more relief from inflation, the Labor Department reported. It cited big discounts in the auto industry, among the hardest hit by the recession. (Page 1.) Industrial production ...",The New York Times,[u'NO INDEX TERMS'],http://www.nytimes.com/1982/10/16/business/business-digest-saturday-october-16-1982-the-economy.html,10/16/82,Summary,4fd1267a8eb7c8105d5ed91c
DOW DROPS AS RECORD WEEK ENDS,Business,[],643,"Prices dropped yesterday as the New York Stock Exchange completed a week in which the volume of trading was the heaviest in history.  The Dow Jones industrial average, which was in the minus column throughout the session, closed down 3.77 points, ...",The New York Times,"[u'STOCKS AND BONDS', u'DOW JONES STOCK AVERAGE', u'STOCK PRICES AND TRADING VOLUME']",http://www.nytimes.com/1982/10/16/business/dow-drops-as-record-week-ends.html,10/16/82,News,4fd129138eb7c8105d5f07ac
NEW JERSEY JOURNAL,New York and Region,[u'NEW JERSEY'],1451,"NEIL A.UPMEYER, former director of the state's Division of Elections, turned up a few surprises when he analyzed the results of the last five statewide elections for his ''1982 New Jersey Target Book.''   The biggest myth to be exposed was the one...",The New York Times,[],http://www.nytimes.com/1982/10/17/nyregion/new-jersey-journal-220705.html,10/17/82,News,4fd128428eb7c8105d5ef011
IT?,Week in Review,[],1187,"For a change, the housing industry got some good news last week: Interest rates for Government-insured home mortgages declined to 12.5 percent from 13.5 percent, the lowest rate in more than two years. Rates for conventional home mortgages are als...",The New York Times,"[u'LIFE STYLES', u'MORTGAGES', u'HOUSING', u'INDUSTRY PROFILES']",http://www.nytimes.com/1982/10/17/weekinreview/the-end-of-housing-as-we-ve-known-it.html,10/17/82,News,4fd12a8a8eb7c8105d5f2ce1
RETRAINING OF WORKERS BECOMES A PRIORITY,,[u'UNITED STATES'],1156,"AT the age of 30, Brenda Harrison felt trapped. She lived with her t hree children in Washington, D.C., trying to make ends meet on the $ 12,000 a year she made from a job at the Veterans Administration, p reparing memorial certificates for the fa...",The New York Times,"[u'UNEMPLOYMENT AND JOB MARKET', u'DATA PROCESSING']",http://www.nytimes.com/1982/10/17/jobs/the-marketplace-retraining-of-workers-becomes-a-priority.html,10/17/82,News,4fd12b7d8eb7c8105d5f4a98
THE BLAME GAME,Opinion,[],906,"'In recent weeks,'' President Reagan said on television the other night, ''a lot of people have been playing what I call 'The Blame Game.' The accusing finger has pointed in every direction of the compass, and a lot of time and hot air have been ...",The New York Times,[u'UNITED STATES ECONOMY'],http://www.nytimes.com/1982/10/17/opinion/washington-the-blame-game.html,10/17/82,Op-Ed,4fd128428eb7c8105d5ef01c
MR. REAGAN'S COURSE,Opinion,[],845,"'What better way to cap off a big week of momentum towards recovery,'' President Reagan asked Friday, ''than this morning's Producer Price Index report - down another one-tenth last month and up only 3.1 percent so far this year?''   Well, it's f...",The New York Times,[u'UNITED STATES ECONOMY'],http://www.nytimes.com/1982/10/17/opinion/in-the-nation-mr-reagan-s-course.html,10/17/82,Op-Ed,4fd12a8a8eb7c8105d5f2cf2
GERIATRICS FIELD OFFERS A PROMISING FUTURE,Health,[u'UNITED STATES'],1208,"AFTER working as an aeronautical engineer for many years, Marilyn S hilkoff enrolled in graduate school to study gerontology, because h er job lacked social contacts and because, she said, of a growing s atisfaction she was experiencing in working...",The New York Times,"[u'UNEMPLOYMENT AND JOB MARKET', u'LABOR', u'UNITED STATES ECONOMY', u'AGED', u'MEDICINE AND HEALTH']",http://www.nytimes.com/1982/10/17/jobs/geriatrics-field-offers-a-promising-future.html,10/17/82,News,4fd12b7d8eb7c8105d5f4a96
BOOM-AND-BUST THEORY SHINES LIKE NEW,Week in Review,[],986,"In the midst of the Western world's economic plight and faint hopes for early recovery, what do the following have in common: the battle of Waterloo, the Vienna stock market crash of 1873, the ''Roaring 20's,'' the first oil price shock and Leviti...",The New York Times,[u'ECONOMICS'],http://www.nytimes.com/1982/10/17/weekinreview/boom-and-bust-theory-shines-like-new.html,10/17/82,News,4fd12b7d8eb7c8105d5f4a9e
WHAT TO DO WITH MONEY,Arts; Books,[],1845,"WITH bank failures, bankruptcies and unemployment all rising, it is small wonder that people are concerned about money. One barometer of financial anxiety is the mushrooming of personal finance and money management books.   Some explain how to inv...",The New York Times,"[u'UNITED STATES ECONOMY', u'BOOKS AND LITERATURE', u'BOOK TRADE']",http://www.nytimes.com/1982/10/17/books/what-to-do-with-money.html,10/17/82,News,4fd129be8eb7c8105d5f17a5
WASHINGTON,,[u'UNITED STATES'],1616,"THE job picture doesn't look great. The nation's economy is still s truggling to find its way out of the second recession in three y ears, which has pushed the unemployment rate up to a post-World War I I record of 10.1 percent.   The last year ha...",The New York Times,"[u'UNEMPLOYMENT AND JOB MARKET', u'UNITED STATES ECONOMY']",http://www.nytimes.com/1982/10/17/jobs/slow-unemployment-decline-foreseen-by-job-experts-washington.html,10/17/82,News,4fd129be8eb7c8105d5f17a4
BEHIND EVERY SUCCESSFUL ROBOT IS A TECHNICIAN,,[u'UNITED STATES'],1126,"THE robot, that blend of machine tool and computer built to perform t he most humdrum tasks with consistency, has become the key factor int he push toward the manless American factory. In the coming decade, a s companies in the United States forge...",The New York Times,"[u'LABOR', u'UNEMPLOYMENT AND JOB MARKET', u'UNITED STATES ECONOMY', u'DATA PROCESSING', u'FACTORIES AND INDUSTRIAL PLANTS']",http://www.nytimes.com/1982/10/17/jobs/the-new-technology-behind-every-successful-robot-is-a-technician.html,10/17/82,News,4fd124488eb7c8105d5e910c
THE FED TAKES A RISKY NEW PATH,Business; Washington,[],2172,"IN October 1979, with great fanfare, the Federal Reserve embarked on a grand new experiment for managing m onetary policy. Now, with somewhat fewer flourishes, the Fed appearst o have suddenly turned from that course.   Though the central bank jus...",The New York Times,"[u'UNITED STATES POLITICS AND GOVERNMENT', u'UNITED STATES ECONOMY', u'MONEY SUPPLY (ECONOMIC INDICATOR)']",http://www.nytimes.com/1982/10/17/business/the-fed-takes-a-risky-new-path.html,10/17/82,News,4fd126758eb7c8105d5ed523
PAPERBACK PUBLISHING'S LATEST PUSH,Business; Books,[],742,"As the recession lingers, with lagging sales in everything from books to bungalows, some marketers and advertising folk are paying greater attention to the he-man male market with its longdemonstrated demand for certain products, which range from ...",The New York Times,"[u'UNITED STATES ECONOMY', u'ADVERTISING', u'BOOKS AND LITERATURE']",http://www.nytimes.com/1982/10/17/business/what-s-new-in-marketing-paperback-publishing-s-latest-push.html,10/17/82,News,4fd126758eb7c8105d5ed52f
MIDDLE MANAGERS ARE GETTING SQUEEZED OUT,,[u'UNITED STATES'],890,"'I M an engineer,'' said the middle-aged man standing in a state unemployment-compensation line in Morristown, N.J., ''and Allied Corporation let me go at this age, along with quite a few others.'' Another unemployed middle-aged manager in the li...",The New York Times,"[u'UNEMPLOYMENT AND JOB MARKET', u'EXECUTIVES AND MANAGEMENT', u'UNITED STATES ECONOMY']",http://www.nytimes.com/1982/10/17/jobs/the-marketplace-middle-managers-are-getting-squeezed-out.html,10/17/82,News,4fd13af68eb7c8105d6103da
"MONDAY, OCTOBER 18, 1982; The Economy",Business,[],384,"Bankers expect the prime rate to slip further in coming weeks, but they offer various reasons. Many at the American Bankers Association convention in Atlanta predict sluggish demand for credit because of the weakened economy; others talk about the...",The New York Times,[u'NO INDEX TERMS'],http://www.nytimes.com/1982/10/18/business/business-digest-monday-october-18-1982-the-economy.html,10/18/82,Summary,4fd1290a8eb7c8105d5f03de
FRENCH LEAD WAY IN SUBWAY EXPORTS,Business,"[u'NEW YORK CITY', u'SAN FRANCISCO (CALIF)', u'FRANCE']",978,New York City's decision to buy 225 subway cars from the Francorail consortium is another chapter in one of French industry's least-known success stories: the design and production of underground transport systems and equipment.   Almost anywhere ...,The New York Times,"[u'UNITED STATES ECONOMY', u'UNITED STATES INTERNATIONAL TRADE', u'INDUSTRY PROFILES', u'RAILROADS']",http://www.nytimes.com/1982/10/18/business/french-lead-way-in-subway-exports.html,10/18/82,News,4fd12b7e8eb7c8105d5f4b0f
10% PRIME BY DEC. 31 HELD LIKELY,Business,[],766,"The prime rate, which dropped to 12 percent only last week, will fall further by year-end, perhaps as low as 10 percent, according to bankers attending the annual convention of the American Bankers Association here.   But the bankers' optimism tha...",The New York Times,"[u'UNITED STATES ECONOMY', u'DISCOUNT RATE', u'INTEREST (MONEY)', u'PRIME RATE', u'MUTUAL FUNDS', u'BANKS AND BANKING']",http://www.nytimes.com/1982/10/18/business/10-prime-by-dec-31-held-likely.html,10/18/82,News,4fd129bf8eb7c8105d5f183a
Monsanto Off 42.6%; Merck Up,Business,[],568,"The Monsanto Company, a major producer of plastics, fibers and industrial and agricultural chemicals, said yesterday that its third-quarter net income fell 42.6 percent from an unusually strong quarter a year earlier, to $71 million, or $1.79 a sh...",The New York Times,"[u'FINANCES', u'COMPANY REPORTS']",http://www.nytimes.com/1982/10/19/business/monsanto-off-42.6-merck-up.html,10/19/82,News,4fd124908eb7c8105d5e9c28
MICHIGAN CAMPAIGNS FIND A COMMON THEME IN 15.9% UNEMPLOYMENT RATE; The 1982 Election: Michigan Eighth of 10 articles appearing periodically on states with important gubernatorial races.,U.S.,"[u'MICHIGAN', u'UNITED STATES']",1987,"When the national unemployment rate reached 10.1 percent for September, the question in much of the country was how important a political issue that number would be in the Congressional elections.   In Michigan, where unemployment is at 15.9 perce...",The New York Times,"[u'UNEMPLOYMENT AND JOB MARKET', u'GEOGRAPHIC PROFILES', u'ELECTION ISSUES', u'GOVERNORS (US)', u'POLITICS AND GOVERNMENT', u'ECONOMIC CONDITIONS AND TRENDS', u'ELECTIONS']",http://www.nytimes.com/1982/10/19/us/campaign-report-michigan-campaigns-find-common-theme-15.9-unemployment-rate-1982.html,10/19/82,Series,4fd126768eb7c8105d5ed5a3
No Headline,U.S.; Washington,[u'UNION OF SOVIET SOCIALIST REPUBLICS'],379,"CAMPAIGN REPORT; REAGAN STRESSES 'GOOD NEWS' IN SPEECH TO RALLIES   WASHINGTON, Oct. 18 (UPI) - President Reagan urged Republican audiences in 16 states today to try hard to elect Republican candidates Nov. 2, saying the party could run on the ''g...",The New York Times,"[u'GAS (FUEL)', u'UNITED STATES POLITICS AND GOVERNMENT', u'INTERNATIONAL TRADE AND WORLD MARKET', u'PIPELINES', u'BOYCOTTS', u'ELECTIONS']",http://www.nytimes.com/1982/10/19/us/no-headline-231107.html,10/19/82,News,4fd128438eb7c8105d5ef0af
"DOW RISES BY 26.12, TO 1,019.22",Business,[],768,"The Dow Jones industrial average, surging ahead yesterday amid forecasts of further extended declines in interest rates, jumped 26.12 points, to 1,019.22, its highest level in nearly 18 months.   The sharp rise put the Dow average, for the second ...",The New York Times,"[u'STOCKS AND BONDS', u'DOW JONES STOCK AVERAGE', u'STOCK PRICES AND TRADING VOLUME']",http://www.nytimes.com/1982/10/19/business/dow-rises-by-26.12-to-1019.22.html,10/19/82,News,4fd12a8d8eb7c8105d5f2dcd
"TUESDAY, OCTOBER 19, 1982; Markets",Business,[],628,"The Dow Jones industrial average rose 26.12 points, to 1,019.22, its highest level in nearly 18 months, on forecasts of further interest rate declines. Trading volume, however, was relatively light by recent standards, with a turnover of 83.8 mill...",The New York Times,[u'NO INDEX TERMS'],http://www.nytimes.com/1982/10/19/business/business-digest-tuesday-october-19-1982-markets.html,10/19/82,Summary,4fd1290a8eb7c8105d5f0405
