headline,section,locations,word_count,snippet,source,subjects,url,date,type,idChina Celebrates 10 Years Along the Capitalist Road,Week in Review,"[u""CHINA, PEOPLE'S REPUBLIC OF""]",1118,"LEAD: THE winter air was filled with rumors and anticipation in December 1978, as Communist Party leaders from across China gathered in the capital for a showdown. Yet almost no one could have imagined that this meeting would give birth to the swe...",The New York Times,"[u'POLITICS AND GOVERNMENT', u'STOCKS AND BONDS', u'ECONOMIC CONDITIONS AND TRENDS', u'FOREIGN INVESTMENT']",http://www.nytimes.com/1989/01/01/weekinreview/the-world-china-celebrates-10-years-along-the-capitalist-road.html,1/1/89,News,4fd17e258eb7c8105d678c52"For Grim Soviet Consumers, The New Year of Discontent",World,[],1076,"LEAD: The Soviet Union is facing the brightest holiday on its calendar in the grimmest mood anyone can remember, primarily because of food and consumer-goods shortages that seem to grow more acute by the day....",The New York Times,[u'TERMS NOT AVAILABLE'],http://www.nytimes.com/1989/01/01/world/for-grim-soviet-consumers-the-new-year-of-discontent.html,1/1/89,News,4fd187b58eb7c8105d6879d5Business Leaders See Continued Growth,New York and Region,[u'WESTCHESTER COUNTY (NY)'],1751,"LEAD: WHAT do Westchester business leaders see in store for the New Year? In contrast to the national uncertainty about the strength of the economy, Westchester observers are anticipating that this year the local business climate will favor econom...",The New York Times,[u'SMALL BUSINESS'],http://www.nytimes.com/1989/01/01/nyregion/business-leaders-see-continued-growth.html,1/1/89,News,4fd1923e8eb7c8105d69b413Financiers Sense an Opportunity In the Savings Industry's Distress,U.S.,[],2216,"LEAD: Many of the nation's most troubled savings institutions are being rescued these days by many of the nation's savviest and most aggressive financiers, corporate executives and takeover experts....",The New York Times,[u'TERMS NOT AVAILABLE'],http://www.nytimes.com/1989/01/01/us/financiers-sense-an-opportunity-in-the-savings-industry-s-distress.html,1/1/89,News,4fd1a1c58eb7c8105d6b7b93Japan Slips in Smokestack America,Business,"[u'JAPAN', u'UNITED STATES']",2357,"LEAD: Prospects for reviving the beleaguered National Steel Corporation seemed bright in 1984, when the Nippon Kokan K.K. Corporation acquired a 50 percent interest in the nation's sixth-largest steel producer. With deep pockets and technical prow...",The New York Times,"[u'COMPANY AND ORGANIZATION PROFILES', u'FINANCES', u'STEEL AND IRON']",http://www.nytimes.com/1989/01/01/business/japan-slips-in-smokestack-america.html,1/1/89,News,4fd1923e8eb7c8105d69b410"Pondering Profits, Problems and the Future",Business,[],1642,"LEAD: As the new year begins, many of the old economic troubles remain - the budget and trade deficits, for instance. In addition, both the leading economic indicators and home sales are sharply down. Business Forum editor Joel Kurtzman talked to ...",The New York Times,"[u'UNITED STATES ECONOMY', u'FORECASTS']",http://www.nytimes.com/1989/01/01/business/business-forum-look-year-ahead-pondering-profits-problems-future.html,1/1/89,Text,4fd187b58eb7c8105d6879d1Foreign Stock Gains Outpaced U.S. in 1988,Business,[],1810,"LEAD: The Bund and the Bourse. Tokyo and Madrid. Rome and Oslo. They are nowhere near Wall Street. But they are where Americans should be buying many of their stocks, a growing number of analysts say....",The New York Times,[u'TERMS NOT AVAILABLE'],http://www.nytimes.com/1989/01/02/business/international-report-foreign-stock-gains-outpaced-us-in-1988.html,1/2/89,News,4fd187ac8eb7c8105d6874b3Airline Profits Seen Surging To Post-Regulation Record,Business,[],911,"LEAD: On the strength of higher air fares and modest growth in traffic, airline profits in the United States are soaring to their highest level since the industry was deregulated 10 years ago....",Reuters,[u'TERMS NOT AVAILABLE'],http://www.nytimes.com/1989/01/02/business/airline-profits-seen-surging-to-post-regulation-record.html,1/2/89,News,4fd199e78eb7c8105d6aa510Debt-Equity Swaps Draw Latin Criticisms,Business,[],1340,"LEAD: As the incoming Bush administration prepares to take its promised new look at Latin America's foreign debt crisis, the one well-tried method of reducing the region's payments - through conversion of debt into equity - is coming under fire in...",The New York Times,[u'TERMS NOT AVAILABLE'],http://www.nytimes.com/1989/01/02/business/debt-equity-swaps-draw-latin-criticisms.html,1/2/89,News,4fd17da88eb7c8105d677a59Tariffs Lifted By Venezuela,Business,[],255,"LEAD: Venezuela on Friday sharply increased the import tariffs on about 500 consumer goods, including liquor and electronic items, to curb imports and stem a drain of foreign reserves....",Reuters,[u'TERMS NOT AVAILABLE'],http://www.nytimes.com/1989/01/02/business/tariffs-lifted-by-venezuela.html,1/2/89,News,4fd1884e8eb7c8105d688743BUSINESS DIGEST,Business,[],710,"LEAD:  THE ECONOMY  The economy grew in December at the highest rate in five months, partly because of a surge in export orders, according to the monthly report of purchasing managers. Production, new orders and export orders all surged. [ Page D1...",The New York Times,[],http://www.nytimes.com/1989/01/03/business/business-digest-370089.html,1/3/89,Summary,4fd17dac8eb7c8105d677d65NEWS SUMMARY,New York and Region,[],830,LEAD:  International A2-11...,The New York Times,[],http://www.nytimes.com/1989/01/03/nyregion/news-summary-371289.html,1/3/89,Summary,4fd1a1c48eb7c8105d6b7ad3Economy's Captain Picks a Crucial Battle And Has Some Luck,Business,[],375,"LEAD: Alan Greenspan, chairman of the Federal Reserve Board, emerged in 1988 as the interim captain of the American economy....",The New York Times,[u'UNITED STATES ECONOMY'],http://www.nytimes.com/1989/01/03/business/men-behind-biggest-stories-wall-street-washington-alan-greenspan-federal-reserve.html,1/3/89,News,4fd1a1c48eb7c8105d6b7ae2"Ghana, Once 'Hopeless,' Gets At Least the Look of Success",World; Front Page,[u'GHANA'],1574,"LEAD: More than five years ago, when the World Bank decided to make the state-dominated economy here a model for free-market innovations in Africa, Ghana was in the grip of stagnation. Since then, Ghana has boasted Africa's highest consistent grow...",The New York Times,"[u'REFORM AND REORGANIZATION', u'ECONOMIC CONDITIONS AND TRENDS', u'FOREIGN AID']",http://www.nytimes.com/1989/01/03/world/ghana-once-hopeless-gets-at-least-the-look-of-success.html,1/3/89,News,4fd187b38eb7c8105d68791aChina's Big Lurch Backward Theory Is Now Seen as Study in Pragmatism,World,"[u""CHINA, PEOPLE'S REPUBLIC OF""]",1208,"LEAD: Despite China's steps in recent months to restore central planning in some areas of its economy, there are growing signs that the country remains committed to developing more of a market economy....",The New York Times,"[u'REFORM AND REORGANIZATION', u'WAGE AND PRICE CONTROLS', u'ECONOMIC CONDITIONS AND TRENDS']",http://www.nytimes.com/1989/01/03/world/china-s-big-lurch-backward-theory-is-now-seen-as-study-in-pragmatism.html,1/3/89,News,4fd17dac8eb7c8105d677d62When Dividends Are Bad News,Business,[],885,"LEAD: AMERICAN corporations are raising the dividends they pay to shareholders. Paradoxically, this may indicate that now is not a good time to buy stocks....",The New York Times,"[u'DIVIDENDS', u'INVESTMENT STRATEGIES', u'STOCKS AND BONDS']",http://www.nytimes.com/1989/01/04/business/market-place-when-dividends-are-bad-news.html,1/4/89,News,4fd192388eb7c8105d69aeb12 Studies Show Big Drops In U.S. Share of Electronics,Business,"[u'JAPAN', u'UNITED STATES']",579,"LEAD: Two recent studies conducted by Japanese and European organizations show that the United States' share of the world's electronics production has dropped far more dramatically than previously estimated, a United States trade group said today....",The New York Times,"[u'INTERNATIONAL TRADE AND WORLD MARKET', u'ELECTRONICS', u'PRODUCTION']",http://www.nytimes.com/1989/01/05/business/2-studies-show-big-drops-in-us-share-of-electronics.html,1/5/89,News,4fd180bf8eb7c8105d67c966BUSINESS DIGEST,Business,[],622,LEAD:  INTERNATIONAL  A high-speed European rail network that would sharply cut travel times is in the works. [ Page A1. ] THE ECONOMY  The F.D.I.C. wants new powers to increase premiums on banks and to rein in high-risk lending. [ A1. ] President...,The New York Times,[],http://www.nytimes.com/1989/01/05/business/business-digest-929389.html,1/5/89,Summary,4fd1923a8eb7c8105d69b014Rates Steady in Quiet Trading,Business,[],612,"LEAD: The prices of Treasury notes and bonds were little changed in lackluster, apathetic trading yesterday....",The New York Times,"[u'CREDIT', u'BOND PRICES AND TRADING VOLUME', u'STOCKS AND BONDS', u'GOVERNMENT BONDS']",http://www.nytimes.com/1989/01/05/business/credit-markets-rates-steady-in-quiet-trading.html,1/5/89,News,4fd199e98eb7c8105d6aa5fbWest Germans Try to Curb Dollar's Rally,Business,"[u'WEST GERMANY', u'UNITED STATES']",683,"LEAD: The West German central bank intervened against a surging dollar yesterday, indicating its increasing displeasure with the dollar's growing strength....",The New York Times,"[u'INTERNATIONAL MONETARY SYSTEM', u'CURRENCY']",http://www.nytimes.com/1989/01/06/business/currency-markets-west-germans-try-to-curb-dollar-s-rally.html,1/6/89,News,4fd180b98eb7c8105d67c493Dow Climbs To Highest Since Crash,Business,[u'UNITED STATES'],552,"LEAD: Stocks rose broadly in heavier trading yesterday, lifting the Dow Jones industrial average to the highest close since the October 1987 crash....",The New York Times,"[u'STOCKS AND BONDS', u'DOW JONES STOCK AVERAGE', u'STOCK PRICES AND TRADING VOLUME']",http://www.nytimes.com/1989/01/06/business/dow-climbs-to-highest-since-crash.html,1/6/89,News,4fd180b98eb7c8105d67c49dBUSINESS DIGEST,Business,[],583,LEAD:  The Economy...,The New York Times,[],http://www.nytimes.com/1989/01/06/business/business-digest-237289.html,1/6/89,Summary,4fd199e28eb7c8105d6aa17bEconomic Scene; Recession in '89? Majority Doubt It,Business,[],941,LEAD: WHAT lies ahead for the economy in 1989?...,The New York Times,"[u'RECESSION AND DEPRESSION', u'UNITED STATES ECONOMY', u'FORECASTS']",http://www.nytimes.com/1989/01/06/business/economic-scene-recession-in-89-majority-doubt-it.html,1/6/89,News,4fd187a68eb7c8105d6871c0Jobless Rate Down for 5th Year in a Row,U.S.,[u'UNITED STATES'],1090,"LEAD: The Labor Department said today that unemployment fell in 1988 for the fifth year in a row, to a yearly average of 5.4 percent....",The New York Times,"[u'UNEMPLOYMENT AND JOB MARKET', u'LABOR', u'WAGES AND SALARIES']",http://www.nytimes.com/1989/01/07/us/jobless-rate-down-for-5th-year-in-a-row.html,1/7/89,News,4fd188558eb7c8105d688b72"Oaxaca, Poised on the Edge of a Boom",Travel,"[u'MEXICO', u'OAXACA (MEXICO)']",3185,"LEAD: ESSENTIALLY, foreign travelers are drawn to Mexico for any of four reasons: beaches, pre-Columbian ruins, Spanish colonial architecture or traditional handicrafts. It is ironic, then, that one of the few regions that contains all these attra...",The New York Times,[u'TRAVEL AND VACATIONS'],http://www.nytimes.com/1989/01/08/travel/oaxaca-poised-on-the-edge-of-a-boom.html,1/8/89,News,4fd187a48eb7c8105d6870bfHow Israel's Economic Revival Ran Out of Steam,Week in Review,"[u'ISRAEL, STATE OF']",844,"LEAD: AT the turn of the century, the creed of the founders of modern Israel was Labor Zionism. Steeped in European socialism and a belief in hard outdoor work, and determined to escape pogroms and shtetls, they sought not only a new country, but ...",The New York Times,"[u'INTERNATIONAL TRADE AND WORLD MARKET', u'POLITICS AND GOVERNMENT', u'ECONOMIC CONDITIONS AND TRENDS']",http://www.nytimes.com/1989/01/08/weekinreview/the-world-how-israel-s-economic-revival-ran-out-of-steam.html,1/8/89,News,4fd17da48eb7c8105d677762MR. STOCK MARKET': Li Yining; Selling China on a 'Public' Privatization,Business,"[u""CHINA, PEOPLE'S REPUBLIC OF""]",1917,"LEAD: Some economists dream of writing textbooks, others of having equations named for them. Li Yining is more ambitious: He dreams of changing China....",The New York Times,"[u'REFORM AND REORGANIZATION', u'ECONOMIC CONDITIONS AND TRENDS']",http://www.nytimes.com/1989/01/08/business/mr-stock-market-li-yining-selling-china-on-a-public-privatization.html,1/8/89,News,4fd192358eb7c8105d69ab61Rebuild America by Rebuilding Labor,Business,[],987,"LEAD: A dangerous, virtually unquestioned assumption has taken hold of American management - that the best way to be competitive is to cut people, wages and salaries. This assumption has led to the trade deficits that are bankrupting America, and ...",The New York Times,"[u'LABOR', u'EXECUTIVES AND MANAGEMENT', u'LAYOFFS (LABOR)', u'WAGES AND SALARIES', u'CORPORATIONS']",http://www.nytimes.com/1989/01/08/business/business-forum-wages-and-productivity-rebuild-america-by-rebuilding-labor.html,1/8/89,News,4fd187a48eb7c8105d6870d0WESTCHESTER GUIDE,New York and Region,[],1100,"LEAD:  A NEW EUROPE  In 1992 twelve European nations will lift all restrictions on their citizens' ability to live and work in each others' countries. ''There will really be a united European nation,'' said Henry Gordan, moderator of a forum calle...",The New York Times,[u'ENTERTAINMENT AND AMUSEMENTS'],http://www.nytimes.com/1989/01/08/nyregion/westchester-guide-342589.html,1/8/89,News,4fd1a1b88eb7c8105d6b7145The Battle to Save the Banks,Business,[u'UNITED STATES'],1872,"LEAD: The silent run was accelerating at the First RepublicBank Corporation's offices in Texas - silent because retail customers were not lining up on the streets. This run was being fueled by large institutions, including other banks, racing to e...",The New York Times,"[u'SAVINGS AND LOAN ASSOCIATIONS', u'BANKS AND BANKING']",http://www.nytimes.com/1989/01/08/business/business-forum-at-the-chairman-s-side-the-battle-to-save-the-banks.html,1/8/89,News,4fd1a1b88eb7c8105d6b7135BUSH AIDES STUDY IDEAS TO REDIRECT GOALS OF BUSINESS,Front Page; Business,[],1823,"LEAD: President-elect George Bush's economic policy makers are preparing proposals to encourage American businesses to concentrate more on productivity and growth and less on quick profits, Mr. Bush's advisers in the Treasury Department report....",The New York Times,"[u'CAPITAL GAINS TAX', u'TAXATION', u'UNITED STATES ECONOMY', u'PRODUCTIVITY']",http://www.nytimes.com/1989/01/09/business/bush-aides-study-ideas-to-redirect-goals-of-business.html,1/9/89,News,4fd187a78eb7c8105d6872e6The Ant and the Grasshopper; Why Is U.S. Prosperity Eroding? Japan's Lessons.,Opinion,[u'JAPAN'],869,"LEAD: Japan and America are engaged in a furious struggle of which many Americans seem scarcely aware, a struggle that neither has to lose....",The New York Times,"[u'INTERNATIONAL TRADE AND WORLD MARKET', u'SURVEYS AND SERIES', u'UNITED STATES ECONOMY', u'EDITORIALS', u'PRODUCTIVITY', u'SCIENCE AND TECHNOLOGY', u'RESEARCH', u'FEDERAL AID (US)', u'ECONOMIC CONDITIONS AND TRENDS', u'NEW MODELS, DESIGN AND PRODUCTS']",http://www.nytimes.com/1989/01/09/opinion/the-ant-and-the-grasshopper-why-is-us-prosperity-eroding-japan-s-lessons.html,1/9/89,Editorial; Series,4fd1884b8eb7c8105d68857fBUSINESS DIGEST,Business,[],652,"LEAD:  THE ECONOMY  President-elect Bush's economic team is preparing proposals to encourage businesses to concentrate more on productivity and growth and less on quick profits, Treasury officials say. The new administration hopes to confront prob...",The New York Times,[],http://www.nytimes.com/1989/01/09/business/business-digest-917789.html,1/9/89,Summary,4fd192378eb7c8105d69ad6a"From Russia, With Love for U.S. Goods",Front Page; Travel; New York and Region,"[u'NEW YORK CITY', u'UNION OF SOVIET SOCIALIST REPUBLICS (USSR)']",1637,"LEAD: In Brooklyn, Queens, New Jersey and on Long Island, wherever Russian is spoken these days around New York, you can hear variations on amused laments about the ''vacuum cleaners,'' one of the latest phenomena spawned by a changing Soviet Unio...",The New York Times,"[u'SALES', u'VISAS', u'TRAVEL AND VACATIONS', u'RETAIL STORES AND TRADE']",http://www.nytimes.com/1989/01/10/nyregion/from-russia-with-love-for-us-goods.html,1/10/89,News,4fd1923c8eb7c8105d69b282"New Wind for the Panting Giant; Tasks for America: Compete, Save, Stimulate, Persist",Opinion,[u'JAPAN'],862,"LEAD: Twenty years ago, America's economy was the envy of friends and enemies, an engine of progress leading the world in virtually every branch of technology and generating the world's highest living standard. Today it is a panting giant, increas...",The New York Times,"[u'INTERNATIONAL TRADE AND WORLD MARKET', u'SURVEYS AND SERIES', u'UNITED STATES ECONOMY', u'EDITORIALS', u'PRODUCTIVITY', u'SCIENCE AND TECHNOLOGY', u'RESEARCH', u'NEW MODELS, DESIGN AND PRODUCTS']",http://www.nytimes.com/1989/01/10/opinion/new-wind-for-the-panting-giant-tasks-for-america-compete-save-stimulate-persist.html,1/10/89,Editorial; Series,4fd187b28eb7c8105d68782bCalifornia's 6-Year Boom May Be Over,Business,[u'CALIFORNIA'],1344,"LEAD: California's six-year economic boom, which strengthened the state's image as a land of boundless opportunity, may be coming to an end....",The New York Times,"[u'WATER POLLUTION', u'DEFENSE CONTRACTS', u'SHORTAGES', u'HOUSING', u'FORECASTS', u'BUILDING (CONSTRUCTION)', u'ECONOMIC CONDITIONS AND TRENDS', u'WASTE MATERIALS AND DISPOSAL', u'AIR POLLUTION', u'UNITED STATES ARMAMENT AND DEFENSE']",http://www.nytimes.com/1989/01/11/business/california-s-6-year-boom-may-be-over.html,1/11/89,News,4fd17e208eb7c8105d6787afROUND OF SELLING ENDS DOLLAR RALLY,Front Page; Business,"[u'WEST GERMANY', u'UNITED STATES']",779,"LEAD: A new, coordinated round of dollar selling by central banks, led by the Federal Reserve and the West German Bundesbank, stopped a new year's rally in the dollar yesterday....",The New York Times,"[u'INTERNATIONAL MONETARY SYSTEM', u'UNITED STATES ECONOMY', u'CURRENCY', u'CREDIT']",http://www.nytimes.com/1989/01/12/business/currency-markets-round-of-selling-ends-dollar-rally.html,1/12/89,News,4fd180bf8eb7c8105d67c9d1Need for High-Tech Consortiums Stressed,Science; Technology; Business,[u'UNITED STATES'],1644,"LEAD: Executives in several high-tech industries and some academics and Government officials say that if the United States is to remain competitive, it must begin forming a large number of cooperative research and development consortiums. The join...",The New York Times,"[u'JOINT VENTURES AND CONSORTIUMS', u'UNITED STATES ECONOMY', u'SCIENCE AND TECHNOLOGY', u'RESEARCH']",http://www.nytimes.com/1989/01/12/business/need-for-high-tech-consortiums-stressed.html,1/12/89,News,4fd17da98eb7c8105d677b6eBUSINESS DIGEST,Business,[],596,LEAD:  The Economy...,The New York Times,[],http://www.nytimes.com/1989/01/12/business/business-digest-763789.html,1/12/89,Summary,4fd1884f8eb7c8105d68881c"Excerpts From News Session by Bush, Watkins and Bennett",U.S.; Washington,[u'UNITED STATES'],4577,"LEAD: Following are excerpts from a transcript of President-elect George Bush's news conference with Adm. James D. Watkins and William J. Bennett in Washington yesterday, as recorded by The New York Times through the facilities of ABC Radio News: ...",The New York Times,"[u'APPOINTMENTS AND EXECUTIVE CHANGES', u'UNITED STATES POLITICS AND GOVERNMENT', u'DRUG TRAFFIC', u'DRUG ADDICTION AND ABUSE']",http://www.nytimes.com/1989/01/13/us/excerpts-from-news-session-by-bush-watkins-and-bennett.html,1/13/89,Text,4fd192368eb7c8105d69ac88Market Place; Cyclical Stocks Seem Depressed,Business,[],594,"LEAD: THE United States economy is in the seventh year of expansion, and nothing lasts forever....",The New York Times,"[u'STOCKS AND BONDS', u'STOCK PRICES AND TRADING VOLUME']",http://www.nytimes.com/1989/01/13/business/market-place-cyclical-stocks-seem-depressed.html,1/13/89,News,4fd199e28eb7c8105d6aa1d0Intervention Fails to Halt Dollar Rise,Business,[u'UNITED STATES'],804,"LEAD: The dollar surged again yesterday, overcoming a round of coordinated central bank intervention led by the Federal Reserve with repeated dollar selling....",The New York Times,"[u'INTERNATIONAL MONETARY SYSTEM', u'CURRENCY']",http://www.nytimes.com/1989/01/14/business/currency-markets-intervention-fails-to-halt-dollar-rise.html,1/14/89,News,4fd1923b8eb7c8105d69b183PROODUCER PRICES UP 0.4% IN MONTH AND 4% FOR 1988,Business,[],874,"LEAD: In a report signaling that inflationary pressures are still growing, the Labor Department said yesterday that producer prices rose by four-tenths of 1 percent in December....",The New York Times,"[u'UNITED STATES ECONOMY', u'PRICES', u'PRODUCER PRICE INDEX', u'FORECASTS']",http://www.nytimes.com/1989/01/14/business/prooducer-prices-up-0.4-in-month-and-4-for-1988.html,1/14/89,News,4fd187b08eb7c8105d687716CAUTION AT THE FED,Magazine,[],5890,"LEAD: ALAN GREENSPAN, CHAIRMAN OF THE FEDERAL Reserve Board, comes quickly across the office from his big, mahogany-brown desk, and greets his visitor with a nod and a gentle handshake. A friend of his says that Greenspan looks like Woody Allen, a...",The New York Times,"[u'RECESSION AND DEPRESSION', u'UNITED STATES ECONOMY', u'PRICES', u'INTEREST (MONEY)', u'BIOGRAPHICAL INFORMATION', u'CREDIT', u'INFLATION']",http://www.nytimes.com/1989/01/15/magazine/alan-greenspan-caution-at-the-fed.html,1/15/89,News,4fd199e38eb7c8105d6aa256CREATED BY THEIR ENEMIES,Arts; Books,[],1354,LEAD:  THE CONSTRUCTION OF HOMOSEXUALITY  By David F. Greenberg.  635 pp. Illinois:  The University of Chicago Press. $29.95....,The New York Times,[u'BOOK REVIEWS'],http://www.nytimes.com/1989/01/15/books/created-by-their-enemies.html,1/15/89,Review,4fd199e38eb7c8105d6aa25c"Spain, Losing Backward Image, Booms as It Lures Foreign Money",World,[u'SPAIN'],1446,"LEAD: With Europe's fastest economic growth rate and foreign investment that has tripled in five years, Spain is turning into the continent's Sun Belt....",The New York Times,"[u'FOREIGN INVESTMENTS', u'ECONOMIC CONDITIONS AND TRENDS']",http://www.nytimes.com/1989/01/15/world/spain-losing-backward-image-booms-as-it-lures-foreign-money.html,1/15/89,News,4fd180ba8eb7c8105d67c554A Vicious Circle Keeps Latin America in Debt,Washington; Week in Review,[u'LATIN AMERICA'],1382,"LEAD: IMAGINE a family that suddenly finds it can no longer keep up payments on its $80,000 mortgage and falls $6,000 behind....",The New York Times,"[u'UNITED STATES INTERNATIONAL RELATIONS', u'CREDIT']",http://www.nytimes.com/1989/01/15/weekinreview/the-world-a-vicious-circle-keeps-latin-america-in-debt.html,1/15/89,News,4fd192378eb7c8105d69ad2eTurkish Economy at a Turning Point,Business,[u'TURKEY'],1367,"LEAD: As 1988 drew to a close, Turkey's Prime Minister Turgut Ozal received an unusual, and unwelcome, package in the mail: Five men from the western city of Denizli had sent him the belts to their trousers....",The New York Times,"[u'PRICES', u'FINANCES', u'POLITICS AND GOVERNMENT', u'ECONOMIC CONDITIONS AND TRENDS']",http://www.nytimes.com/1989/01/16/business/international-report-turkish-economy-at-a-turning-point.html,1/16/89,News,4fd1923f8eb7c8105d69b44dIndications Look Better for Bonds,Business,[u'UNITED STATES'],888,"LEAD: Credit market conditions could well stabilize or perhaps even improve a bit more during the next few weeks, buttressed by strong technical factors and interest rates that hover close to or above 9 percent across the maturity spectrum....",The New York Times,"[u'FORECASTS', u'CREDIT']",http://www.nytimes.com/1989/01/16/business/credit-markets-indications-look-better-for-bonds.html,1/16/89,News,4fd180c58eb7c8105d67cebfSOVIETS' HARVEST WORST IN 3 YEARS,Front Page; Business,[u'UNION OF SOVIET SOCIALIST REPUBLICS (USSR)'],702,"LEAD: The Soviet Union's grain harvest last year fell 40 million tons short of the target of 235 million tons, according to preliminary estimates, a Soviet offical said today....",The New York Times,"[u'DROUGHT', u'FORECASTS', u'GRAIN', u'PRODUCTION']",http://www.nytimes.com/1989/01/17/business/soviets-harvest-worst-in-3-years.html,1/17/89,News,4fd192398eb7c8105d69af57Excerpts From Baker's Testimony Before Senate Committee,U.S.; Washington,"[u'MIDDLE EAST', u'UNION OF SOVIET SOCIALIST REPUBLICS (USSR)']",3602,"LEAD: Following are excerpts from testimony yesterday by James A. Baker 3d, the nominee for Secretary of State, at his confirmation hearing before the Senate Foreign Relations Committee. The testimony was recorded by The New York Times, through th...",The New York Times,"[u'UNITED STATES INTERNATIONAL RELATIONS', u'APPOINTMENTS AND EXECUTIVE CHANGES', u'INTERNATIONAL RELATIONS', u'CHEMICAL WARFARE']",http://www.nytimes.com/1989/01/18/us/transition-in-washington-excerpts-from-baker-s-testimony-before-senate-committee.html,1/18/89,Text,4fd180bf8eb7c8105d67c907Warning From Tokyo on Trade and Dollar,Business,"[u'JAPAN', u'UNITED STATES']",800,"LEAD: A senior official of Japan's powerful Finance Ministry warned today that a widening trade surplus with the United States would not be improved by further declines in the dollar, suggesting that the Bush administration will have to take a mar...",The New York Times,"[u'INTERNATIONAL TRADE AND WORLD MARKET', u'CURRENCY']",http://www.nytimes.com/1989/01/18/business/warning-from-tokyo-on-trade-and-dollar.html,1/18/89,News,4fd17da98eb7c8105d677ade